### ISSUE TITLE
Adding printer in Windows kills my print server

### ISSUE THREAD

**Issue by automaticgiant** [watson/ipp-printer#1]
Wrote an app around ipp-printer, [automaticgiant/node-jsprinter](/automaticgiant/node-jsprinter), that dies when you add the printer to Windows. I think it's a problem with ipp-printer. I'll add more later probably, but here's the initial report.

```
$ jsprinter
started with printer at ipp://localhost:40023/printers/jsprinter and joblist at http://localhost:40024
C:\Users\Kelli\AppData\Roaming\npm\node_modules\jsprinter\node_modules\ipp-printer\lib\groups.js:67
    .filter(function (name) {
    ^

TypeError: Cannot read property 'filter' of undefined
    at unsupportedAttributes (C:\Users\Kelli\AppData\Roaming\npm\node_modules\jsprinter\node_modules\ipp-printer\lib\groups.js:67:5)
    at Object.unsupportedAttributesTagPrinter (C:\Users\Kelli\AppData\Roaming\npm\node_modules\jsprinter\node_modules\ipp-printer\lib\groups.js:41:17)
    at Object.getPrinterAttributes (C:\Users\Kelli\AppData\Roaming\npm\node_modules\jsprinter\node_modules\ipp-printer\lib\operations.js:34:12)
    at router (C:\Users\Kelli\AppData\Roaming\npm\node_modules\jsprinter\node_modules\ipp-printer\index.js:132:54)
    at IncomingMessage.consumeAttrGroups (C:\Users\Kelli\AppData\Roaming\npm\node_modules\jsprinter\node_modules\ipp-printer\index.js:83:7)
    at emitOne (events.js:77:13)
    at IncomingMessage.emit (events.js:169:7)
    at IncomingMessage.Readable.read (_stream_readable.js:360:10)
    at flow (_stream_readable.js:743:26)
    at resume_ (_stream_readable.js:723:3)
```

**Comment by automaticgiant** [comment]
```
No.     Time           Source                Destination           Protocol Length Info
      1 0.000000000    192.168.0.106         192.168.0.111         TCP      66     59251 → 40023 [SYN] Seq=0 Win=8192 Len=0 MSS=1460 WS=256 SACK_PERM=1

Frame 1: 66 bytes on wire (528 bits), 66 bytes captured (528 bits) on interface 0
    Interface id: 0 (wlp1s0)
    Encapsulation type: Ethernet (1)
    Arrival Time: Nov 26, 2015 00:37:35.268804621 EST
    [Time shift for this packet: 0.000000000 seconds]
    Epoch Time: 1448516255.268804621 seconds
    [Time delta from previous captured frame: 0.000000000 seconds]
    [Time delta from previous displayed frame: 0.000000000 seconds]
    [Time since reference or first frame: 0.000000000 seconds]
    Frame Number: 1
    Frame Length: 66 bytes (528 bits)
    Capture Length: 66 bytes (528 bits)
    [Frame is marked: False]
    [Frame is ignored: False]
    [Protocols in frame: eth:ethertype:ip:tcp]
    [Coloring Rule Name: TCP SYN/FIN]
    [Coloring Rule String: tcp.flags & 0x02 || tcp.flags.fin == 1]
Ethernet II, Src: HonHaiPr_f1:8c:bb (2c:33:7a:f1:8c:bb), Dst: HonHaiPr_f1:8a:fd (2c:33:7a:f1:8a:fd)
    Destination: HonHaiPr_f1:8a:fd (2c:33:7a:f1:8a:fd)
        Address: HonHaiPr_f1:8a:fd (2c:33:7a:f1:8a:fd)
        .... ..0. .... .... .... .... = LG bit: Globally unique address (factory default)
        .... ...0 .... .... .... .... = IG bit: Individual address (unicast)
    Source: HonHaiPr_f1:8c:bb (2c:33:7a:f1:8c:bb)
        Address: HonHaiPr_f1:8c:bb (2c:33:7a:f1:8c:bb)
        .... ..0. .... .... .... .... = LG bit: Globally unique address (factory default)
        .... ...0 .... .... .... .... = IG bit: Individual address (unicast)
    Type: IPv4 (0x0800)
Internet Protocol Version 4, Src: 192.168.0.106, Dst: 192.168.0.111
    0100 .... = Version: 4
    .... 0101 = Header Length: 20 bytes
    Differentiated Services Field: 0x00 (DSCP: CS0, ECN: Not-ECT)
        0000 00.. = Differentiated Services Codepoint: Default (0)
        .... ..00 = Explicit Congestion Notification: Not ECN-Capable Transport (0)
    Total Length: 52
    Identification: 0x6bf0 (27632)
    Flags: 0x02 (Don't Fragment)
        0... .... = Reserved bit: Not set
        .1.. .... = Don't fragment: Set
        ..0. .... = More fragments: Not set
    Fragment offset: 0
    Time to live: 128
    Protocol: TCP (6)
    Header checksum: 0x0caa [validation disabled]
        [Good: False]
        [Bad: False]
    Source: 192.168.0.106
    Destination: 192.168.0.111
Transmission Control Protocol, Src Port: 59251 (59251), Dst Port: 40023 (40023), Seq: 0, Len: 0
    Source Port: 59251
    Destination Port: 40023
    [Stream index: 0]
    [TCP Segment Len: 0]
    Sequence number: 0    (relative sequence number)
    Acknowledgment number: 0
    Header Length: 32 bytes
    Flags: 0x002 (SYN)
        000. .... .... = Reserved: Not set
        ...0 .... .... = Nonce: Not set
        .... 0... .... = Congestion Window Reduced (CWR): Not set
        .... .0.. .... = ECN-Echo: Not set
        .... ..0. .... = Urgent: Not set
        .... ...0 .... = Acknowledgment: Not set
        .... .... 0... = Push: Not set
        .... .... .0.. = Reset: Not set
        .... .... ..1. = Syn: Set
            [Expert Info (Chat/Sequence): Connection establish request (SYN): server port 40023]
                [Connection establish request (SYN): server port 40023]
                [Severity level: Chat]
                [Group: Sequence]
        .... .... ...0 = Fin: Not set
        [TCP Flags: **********S*]
    Window size value: 8192
    [Calculated window size: 8192]
    Checksum: 0xcbeb [validation disabled]
        [Good Checksum: False]
        [Bad Checksum: False]
    Urgent pointer: 0
    Options: (12 bytes), Maximum segment size, No-Operation (NOP), Window scale, No-Operation (NOP), No-Operation (NOP), SACK permitted
        Maximum segment size: 1460 bytes
            Kind: Maximum Segment Size (2)
            Length: 4
            MSS Value: 1460
        No-Operation (NOP)
            Type: 1
                0... .... = Copy on fragmentation: No
                .00. .... = Class: Control (0)
                ...0 0001 = Number: No-Operation (NOP) (1)
        Window scale: 8 (multiply by 256)
            Kind: Window Scale (3)
            Length: 3
            Shift count: 8
            [Multiplier: 256]
        No-Operation (NOP)
            Type: 1
                0... .... = Copy on fragmentation: No
                .00. .... = Class: Control (0)
                ...0 0001 = Number: No-Operation (NOP) (1)
        No-Operation (NOP)
            Type: 1
                0... .... = Copy on fragmentation: No
                .00. .... = Class: Control (0)
                ...0 0001 = Number: No-Operation (NOP) (1)
        TCP SACK Permitted Option: True
            Kind: SACK Permitted (4)
            Length: 2

No.     Time           Source                Destination           Protocol Length Info
      2 0.000078768    192.168.0.111         192.168.0.106         TCP      66     40023 → 59251 [SYN, ACK] Seq=0 Ack=1 Win=29200 Len=0 MSS=1460 SACK_PERM=1 WS=128

Frame 2: 66 bytes on wire (528 bits), 66 bytes captured (528 bits) on interface 0
    Interface id: 0 (wlp1s0)
    Encapsulation type: Ethernet (1)
    Arrival Time: Nov 26, 2015 00:37:35.268883389 EST
    [Time shift for this packet: 0.000000000 seconds]
    Epoch Time: 1448516255.268883389 seconds
    [Time delta from previous captured frame: 0.000078768 seconds]
    [Time delta from previous displayed frame: 0.000078768 seconds]
    [Time since reference or first frame: 0.000078768 seconds]
    Frame Number: 2
    Frame Length: 66 bytes (528 bits)
    Capture Length: 66 bytes (528 bits)
    [Frame is marked: False]
    [Frame is ignored: False]
    [Protocols in frame: eth:ethertype:ip:tcp]
    [Coloring Rule Name: TCP SYN/FIN]
    [Coloring Rule String: tcp.flags & 0x02 || tcp.flags.fin == 1]
Ethernet II, Src: HonHaiPr_f1:8a:fd (2c:33:7a:f1:8a:fd), Dst: HonHaiPr_f1:8c:bb (2c:33:7a:f1:8c:bb)
    Destination: HonHaiPr_f1:8c:bb (2c:33:7a:f1:8c:bb)
        Address: HonHaiPr_f1:8c:bb (2c:33:7a:f1:8c:bb)
        .... ..0. .... .... .... .... = LG bit: Globally unique address (factory default)
        .... ...0 .... .... .... .... = IG bit: Individual address (unicast)
    Source: HonHaiPr_f1:8a:fd (2c:33:7a:f1:8a:fd)
        Address: HonHaiPr_f1:8a:fd (2c:33:7a:f1:8a:fd)
        .... ..0. .... .... .... .... = LG bit: Globally unique address (factory default)
        .... ...0 .... .... .... .... = IG bit: Individual address (unicast)
    Type: IPv4 (0x0800)
Internet Protocol Version 4, Src: 192.168.0.111, Dst: 192.168.0.106
    0100 .... = Version: 4
    .... 0101 = Header Length: 20 bytes
    Differentiated Services Field: 0x00 (DSCP: CS0, ECN: Not-ECT)
        0000 00.. = Differentiated Services Codepoint: Default (0)
        .... ..00 = Explicit Congestion Notification: Not ECN-Capable Transport (0)
    Total Length: 52
    Identification: 0x0000 (0)
    Flags: 0x02 (Don't Fragment)
        0... .... = Reserved bit: Not set
        .1.. .... = Don't fragment: Set
        ..0. .... = More fragments: Not set
    Fragment offset: 0
    Time to live: 64
    Protocol: TCP (6)
    Header checksum: 0xb89a [validation disabled]
        [Good: False]
        [Bad: False]
    Source: 192.168.0.111
    Destination: 192.168.0.106
Transmission Control Protocol, Src Port: 40023 (40023), Dst Port: 59251 (59251), Seq: 0, Ack: 1, Len: 0
    Source Port: 40023
    Destination Port: 59251
    [Stream index: 0]
    [TCP Segment Len: 0]
    Sequence number: 0    (relative sequence number)
    Acknowledgment number: 1    (relative ack number)
    Header Length: 32 bytes
    Flags: 0x012 (SYN, ACK)
        000. .... .... = Reserved: Not set
        ...0 .... .... = Nonce: Not set
        .... 0... .... = Congestion Window Reduced (CWR): Not set
        .... .0.. .... = ECN-Echo: Not set
        .... ..0. .... = Urgent: Not set
        .... ...1 .... = Acknowledgment: Set
        .... .... 0... = Push: Not set
        .... .... .0.. = Reset: Not set
        .... .... ..1. = Syn: Set
            [Expert Info (Chat/Sequence): Connection establish acknowledge (SYN+ACK): server port 40023]
                [Connection establish acknowledge (SYN+ACK): server port 40023]
                [Severity level: Chat]
                [Group: Sequence]
        .... .... ...0 = Fin: Not set
        [TCP Flags: *******A**S*]
    Window size value: 29200
    [Calculated window size: 29200]
    Checksum: 0x6b52 [validation disabled]
        [Good Checksum: False]
        [Bad Checksum: False]
    Urgent pointer: 0
    Options: (12 bytes), Maximum segment size, No-Operation (NOP), No-Operation (NOP), SACK permitted, No-Operation (NOP), Window scale
        Maximum segment size: 1460 bytes
            Kind: Maximum Segment Size (2)
            Length: 4
            MSS Value: 1460
        No-Operation (NOP)
            Type: 1
                0... .... = Copy on fragmentation: No
                .00. .... = Class: Control (0)
                ...0 0001 = Number: No-Operation (NOP) (1)
        No-Operation (NOP)
            Type: 1
                0... .... = Copy on fragmentation: No
                .00. .... = Class: Control (0)
                ...0 0001 = Number: No-Operation (NOP) (1)
        TCP SACK Permitted Option: True
            Kind: SACK Permitted (4)
            Length: 2
        No-Operation (NOP)
            Type: 1
                0... .... = Copy on fragmentation: No
                .00. .... = Class: Control (0)
                ...0 0001 = Number: No-Operation (NOP) (1)
        Window scale: 7 (multiply by 128)
            Kind: Window Scale (3)
            Length: 3
            Shift count: 7
            [Multiplier: 128]
    [SEQ/ACK analysis]
        [This is an ACK to the segment in frame: 1]
        [The RTT to ACK the segment was: 0.000078768 seconds]
        [iRTT: 0.002515157 seconds]

No.     Time           Source                Destination           Protocol Length Info
      3 0.002515157    192.168.0.106         192.168.0.111         TCP      54     59251 → 40023 [ACK] Seq=1 Ack=1 Win=65536 Len=0

Frame 3: 54 bytes on wire (432 bits), 54 bytes captured (432 bits) on interface 0
    Interface id: 0 (wlp1s0)
    Encapsulation type: Ethernet (1)
    Arrival Time: Nov 26, 2015 00:37:35.271319778 EST
    [Time shift for this packet: 0.000000000 seconds]
    Epoch Time: 1448516255.271319778 seconds
    [Time delta from previous captured frame: 0.002436389 seconds]
    [Time delta from previous displayed frame: 0.002436389 seconds]
    [Time since reference or first frame: 0.002515157 seconds]
    Frame Number: 3
    Frame Length: 54 bytes (432 bits)
    Capture Length: 54 bytes (432 bits)
    [Frame is marked: False]
    [Frame is ignored: False]
    [Protocols in frame: eth:ethertype:ip:tcp]
    [Coloring Rule Name: TCP]
    [Coloring Rule String: tcp]
Ethernet II, Src: HonHaiPr_f1:8c:bb (2c:33:7a:f1:8c:bb), Dst: HonHaiPr_f1:8a:fd (2c:33:7a:f1:8a:fd)
    Destination: HonHaiPr_f1:8a:fd (2c:33:7a:f1:8a:fd)
        Address: HonHaiPr_f1:8a:fd (2c:33:7a:f1:8a:fd)
        .... ..0. .... .... .... .... = LG bit: Globally unique address (factory default)
        .... ...0 .... .... .... .... = IG bit: Individual address (unicast)
    Source: HonHaiPr_f1:8c:bb (2c:33:7a:f1:8c:bb)
        Address: HonHaiPr_f1:8c:bb (2c:33:7a:f1:8c:bb)
        .... ..0. .... .... .... .... = LG bit: Globally unique address (factory default)
        .... ...0 .... .... .... .... = IG bit: Individual address (unicast)
    Type: IPv4 (0x0800)
Internet Protocol Version 4, Src: 192.168.0.106, Dst: 192.168.0.111
    0100 .... = Version: 4
    .... 0101 = Header Length: 20 bytes
    Differentiated Services Field: 0x00 (DSCP: CS0, ECN: Not-ECT)
        0000 00.. = Differentiated Services Codepoint: Default (0)
        .... ..00 = Explicit Congestion Notification: Not ECN-Capable Transport (0)
    Total Length: 40
    Identification: 0x6bf1 (27633)
    Flags: 0x02 (Don't Fragment)
        0... .... = Reserved bit: Not set
        .1.. .... = Don't fragment: Set
        ..0. .... = More fragments: Not set
    Fragment offset: 0
    Time to live: 128
    Protocol: TCP (6)
    Header checksum: 0x0cb5 [validation disabled]
        [Good: False]
        [Bad: False]
    Source: 192.168.0.106
    Destination: 192.168.0.111
Transmission Control Protocol, Src Port: 59251 (59251), Dst Port: 40023 (40023), Seq: 1, Ack: 1, Len: 0
    Source Port: 59251
    Destination Port: 40023
    [Stream index: 0]
    [TCP Segment Len: 0]
    Sequence number: 1    (relative sequence number)
    Acknowledgment number: 1    (relative ack number)
    Header Length: 20 bytes
    Flags: 0x010 (ACK)
        000. .... .... = Reserved: Not set
        ...0 .... .... = Nonce: Not set
        .... 0... .... = Congestion Window Reduced (CWR): Not set
        .... .0.. .... = ECN-Echo: Not set
        .... ..0. .... = Urgent: Not set
        .... ...1 .... = Acknowledgment: Set
        .... .... 0... = Push: Not set
        .... .... .0.. = Reset: Not set
        .... .... ..0. = Syn: Not set
        .... .... ...0 = Fin: Not set
        [TCP Flags: *******A****]
    Window size value: 256
    [Calculated window size: 65536]
    [Window size scaling factor: 256]
    Checksum: 0x1d35 [validation disabled]
        [Good Checksum: False]
        [Bad Checksum: False]
    Urgent pointer: 0
    [SEQ/ACK analysis]
        [This is an ACK to the segment in frame: 2]
        [The RTT to ACK the segment was: 0.002436389 seconds]
        [iRTT: 0.002515157 seconds]

No.     Time           Source                Destination           Protocol Length Info
      4 0.003124742    192.168.0.106         192.168.0.111         TCP      231    [TCP segment of a reassembled PDU]

Frame 4: 231 bytes on wire (1848 bits), 231 bytes captured (1848 bits) on interface 0
    Interface id: 0 (wlp1s0)
    Encapsulation type: Ethernet (1)
    Arrival Time: Nov 26, 2015 00:37:35.271929363 EST
    [Time shift for this packet: 0.000000000 seconds]
    Epoch Time: 1448516255.271929363 seconds
    [Time delta from previous captured frame: 0.000609585 seconds]
    [Time delta from previous displayed frame: 0.000609585 seconds]
    [Time since reference or first frame: 0.003124742 seconds]
    Frame Number: 4
    Frame Length: 231 bytes (1848 bits)
    Capture Length: 231 bytes (1848 bits)
    [Frame is marked: False]
    [Frame is ignored: False]
    [Protocols in frame: eth:ethertype:ip:tcp]
    [Coloring Rule Name: TCP]
    [Coloring Rule String: tcp]
Ethernet II, Src: HonHaiPr_f1:8c:bb (2c:33:7a:f1:8c:bb), Dst: HonHaiPr_f1:8a:fd (2c:33:7a:f1:8a:fd)
    Destination: HonHaiPr_f1:8a:fd (2c:33:7a:f1:8a:fd)
        Address: HonHaiPr_f1:8a:fd (2c:33:7a:f1:8a:fd)
        .... ..0. .... .... .... .... = LG bit: Globally unique address (factory default)
        .... ...0 .... .... .... .... = IG bit: Individual address (unicast)
    Source: HonHaiPr_f1:8c:bb (2c:33:7a:f1:8c:bb)
        Address: HonHaiPr_f1:8c:bb (2c:33:7a:f1:8c:bb)
        .... ..0. .... .... .... .... = LG bit: Globally unique address (factory default)
        .... ...0 .... .... .... .... = IG bit: Individual address (unicast)
    Type: IPv4 (0x0800)
Internet Protocol Version 4, Src: 192.168.0.106, Dst: 192.168.0.111
    0100 .... = Version: 4
    .... 0101 = Header Length: 20 bytes
    Differentiated Services Field: 0x00 (DSCP: CS0, ECN: Not-ECT)
        0000 00.. = Differentiated Services Codepoint: Default (0)
        .... ..00 = Explicit Congestion Notification: Not ECN-Capable Transport (0)
    Total Length: 217
    Identification: 0x6bf2 (27634)
    Flags: 0x02 (Don't Fragment)
        0... .... = Reserved bit: Not set
        .1.. .... = Don't fragment: Set
        ..0. .... = More fragments: Not set
    Fragment offset: 0
    Time to live: 128
    Protocol: TCP (6)
    Header checksum: 0x0c03 [validation disabled]
        [Good: False]
        [Bad: False]
    Source: 192.168.0.106
    Destination: 192.168.0.111
Transmission Control Protocol, Src Port: 59251 (59251), Dst Port: 40023 (40023), Seq: 1, Ack: 1, Len: 177
    Source Port: 59251
    Destination Port: 40023
    [Stream index: 0]
    [TCP Segment Len: 177]
    Sequence number: 1    (relative sequence number)
    [Next sequence number: 178    (relative sequence number)]
    Acknowledgment number: 1    (relative ack number)
    Header Length: 20 bytes
    Flags: 0x018 (PSH, ACK)
        000. .... .... = Reserved: Not set
        ...0 .... .... = Nonce: Not set
        .... 0... .... = Congestion Window Reduced (CWR): Not set
        .... .0.. .... = ECN-Echo: Not set
        .... ..0. .... = Urgent: Not set
        .... ...1 .... = Acknowledgment: Set
        .... .... 1... = Push: Set
        .... .... .0.. = Reset: Not set
        .... .... ..0. = Syn: Not set
        .... .... ...0 = Fin: Not set
        [TCP Flags: *******AP***]
    Window size value: 256
    [Calculated window size: 65536]
    [Window size scaling factor: 256]
    Checksum: 0x75ea [validation disabled]
        [Good Checksum: False]
        [Bad Checksum: False]
    Urgent pointer: 0
    [SEQ/ACK analysis]
        [iRTT: 0.002515157 seconds]
        [Bytes in flight: 177]
    TCP segment data (177 bytes)

No.     Time           Source                Destination           Protocol Length Info
      5 0.003156389    192.168.0.111         192.168.0.106         TCP      54     40023 → 59251 [ACK] Seq=1 Ack=178 Win=30336 Len=0

Frame 5: 54 bytes on wire (432 bits), 54 bytes captured (432 bits) on interface 0
    Interface id: 0 (wlp1s0)
    Encapsulation type: Ethernet (1)
    Arrival Time: Nov 26, 2015 00:37:35.271961010 EST
    [Time shift for this packet: 0.000000000 seconds]
    Epoch Time: 1448516255.271961010 seconds
    [Time delta from previous captured frame: 0.000031647 seconds]
    [Time delta from previous displayed frame: 0.000031647 seconds]
    [Time since reference or first frame: 0.003156389 seconds]
    Frame Number: 5
    Frame Length: 54 bytes (432 bits)
    Capture Length: 54 bytes (432 bits)
    [Frame is marked: False]
    [Frame is ignored: False]
    [Protocols in frame: eth:ethertype:ip:tcp]
    [Coloring Rule Name: TCP]
    [Coloring Rule String: tcp]
Ethernet II, Src: HonHaiPr_f1:8a:fd (2c:33:7a:f1:8a:fd), Dst: HonHaiPr_f1:8c:bb (2c:33:7a:f1:8c:bb)
    Destination: HonHaiPr_f1:8c:bb (2c:33:7a:f1:8c:bb)
        Address: HonHaiPr_f1:8c:bb (2c:33:7a:f1:8c:bb)
        .... ..0. .... .... .... .... = LG bit: Globally unique address (factory default)
        .... ...0 .... .... .... .... = IG bit: Individual address (unicast)
    Source: HonHaiPr_f1:8a:fd (2c:33:7a:f1:8a:fd)
        Address: HonHaiPr_f1:8a:fd (2c:33:7a:f1:8a:fd)
        .... ..0. .... .... .... .... = LG bit: Globally unique address (factory default)
        .... ...0 .... .... .... .... = IG bit: Individual address (unicast)
    Type: IPv4 (0x0800)
Internet Protocol Version 4, Src: 192.168.0.111, Dst: 192.168.0.106
    0100 .... = Version: 4
    .... 0101 = Header Length: 20 bytes
    Differentiated Services Field: 0x00 (DSCP: CS0, ECN: Not-ECT)
        0000 00.. = Differentiated Services Codepoint: Default (0)
        .... ..00 = Explicit Congestion Notification: Not ECN-Capable Transport (0)
    Total Length: 40
    Identification: 0x1ddf (7647)
    Flags: 0x02 (Don't Fragment)
        0... .... = Reserved bit: Not set
        .1.. .... = Don't fragment: Set
        ..0. .... = More fragments: Not set
    Fragment offset: 0
    Time to live: 64
    Protocol: TCP (6)
    Header checksum: 0x9ac7 [validation disabled]
        [Good: False]
        [Bad: False]
    Source: 192.168.0.111
    Destination: 192.168.0.106
Transmission Control Protocol, Src Port: 40023 (40023), Dst Port: 59251 (59251), Seq: 1, Ack: 178, Len: 0
    Source Port: 40023
    Destination Port: 59251
    [Stream index: 0]
    [TCP Segment Len: 0]
    Sequence number: 1    (relative sequence number)
    Acknowledgment number: 178    (relative ack number)
    Header Length: 20 bytes
    Flags: 0x010 (ACK)
        000. .... .... = Reserved: Not set
        ...0 .... .... = Nonce: Not set
        .... 0... .... = Congestion Window Reduced (CWR): Not set
        .... .0.. .... = ECN-Echo: Not set
        .... ..0. .... = Urgent: Not set
        .... ...1 .... = Acknowledgment: Set
        .... .... 0... = Push: Not set
        .... .... .0.. = Reset: Not set
        .... .... ..0. = Syn: Not set
        .... .... ...0 = Fin: Not set
        [TCP Flags: *******A****]
    Window size value: 237
    [Calculated window size: 30336]
    [Window size scaling factor: 128]
    Checksum: 0x1c97 [validation disabled]
        [Good Checksum: False]
        [Bad Checksum: False]
    Urgent pointer: 0
    [SEQ/ACK analysis]
        [This is an ACK to the segment in frame: 4]
        [The RTT to ACK the segment was: 0.000031647 seconds]
        [iRTT: 0.002515157 seconds]

No.     Time           Source                Destination           Protocol Length Info
      6 0.003724708    192.168.0.106         192.168.0.111         IPP      190    IPP response

Frame 6: 190 bytes on wire (1520 bits), 190 bytes captured (1520 bits) on interface 0
    Interface id: 0 (wlp1s0)
    Encapsulation type: Ethernet (1)
    Arrival Time: Nov 26, 2015 00:37:35.272529329 EST
    [Time shift for this packet: 0.000000000 seconds]
    Epoch Time: 1448516255.272529329 seconds
    [Time delta from previous captured frame: 0.000568319 seconds]
    [Time delta from previous displayed frame: 0.000568319 seconds]
    [Time since reference or first frame: 0.003724708 seconds]
    Frame Number: 6
    Frame Length: 190 bytes (1520 bits)
    Capture Length: 190 bytes (1520 bits)
    [Frame is marked: False]
    [Frame is ignored: False]
    [Protocols in frame: eth:ethertype:ip:tcp:http:ipp]
    [Coloring Rule Name: HTTP]
    [Coloring Rule String: http || tcp.port == 80 || http2]
Ethernet II, Src: HonHaiPr_f1:8c:bb (2c:33:7a:f1:8c:bb), Dst: HonHaiPr_f1:8a:fd (2c:33:7a:f1:8a:fd)
    Destination: HonHaiPr_f1:8a:fd (2c:33:7a:f1:8a:fd)
        Address: HonHaiPr_f1:8a:fd (2c:33:7a:f1:8a:fd)
        .... ..0. .... .... .... .... = LG bit: Globally unique address (factory default)
        .... ...0 .... .... .... .... = IG bit: Individual address (unicast)
    Source: HonHaiPr_f1:8c:bb (2c:33:7a:f1:8c:bb)
        Address: HonHaiPr_f1:8c:bb (2c:33:7a:f1:8c:bb)
        .... ..0. .... .... .... .... = LG bit: Globally unique address (factory default)
        .... ...0 .... .... .... .... = IG bit: Individual address (unicast)
    Type: IPv4 (0x0800)
Internet Protocol Version 4, Src: 192.168.0.106, Dst: 192.168.0.111
    0100 .... = Version: 4
    .... 0101 = Header Length: 20 bytes
    Differentiated Services Field: 0x00 (DSCP: CS0, ECN: Not-ECT)
        0000 00.. = Differentiated Services Codepoint: Default (0)
        .... ..00 = Explicit Congestion Notification: Not ECN-Capable Transport (0)
    Total Length: 176
    Identification: 0x6bf3 (27635)
    Flags: 0x02 (Don't Fragment)
        0... .... = Reserved bit: Not set
        .1.. .... = Don't fragment: Set
        ..0. .... = More fragments: Not set
    Fragment offset: 0
    Time to live: 128
    Protocol: TCP (6)
    Header checksum: 0x0c2b [validation disabled]
        [Good: False]
        [Bad: False]
    Source: 192.168.0.106
    Destination: 192.168.0.111
Transmission Control Protocol, Src Port: 59251 (59251), Dst Port: 40023 (40023), Seq: 178, Ack: 1, Len: 136
    Source Port: 59251
    Destination Port: 40023
    [Stream index: 0]
    [TCP Segment Len: 136]
    Sequence number: 178    (relative sequence number)
    [Next sequence number: 314    (relative sequence number)]
    Acknowledgment number: 1    (relative ack number)
    Header Length: 20 bytes
    Flags: 0x018 (PSH, ACK)
        000. .... .... = Reserved: Not set
        ...0 .... .... = Nonce: Not set
        .... 0... .... = Congestion Window Reduced (CWR): Not set
        .... .0.. .... = ECN-Echo: Not set
        .... ..0. .... = Urgent: Not set
        .... ...1 .... = Acknowledgment: Set
        .... .... 1... = Push: Set
        .... .... .0.. = Reset: Not set
        .... .... ..0. = Syn: Not set
        .... .... ...0 = Fin: Not set
        [TCP Flags: *******AP***]
    Window size value: 256
    [Calculated window size: 65536]
    [Window size scaling factor: 256]
    Checksum: 0xff68 [validation disabled]
        [Good Checksum: False]
        [Bad Checksum: False]
    Urgent pointer: 0
    [SEQ/ACK analysis]
        [iRTT: 0.002515157 seconds]
        [Bytes in flight: 136]
    TCP segment data (136 bytes)
[2 Reassembled TCP Segments (313 bytes): #4(177), #6(136)]
    [Frame: 4, payload: 0-176 (177 bytes)]
    [Frame: 6, payload: 177-312 (136 bytes)]
    [Segment count: 2]
    [Reassembled TCP length: 313]
    [Reassembled TCP Data: 504f5354202f7072696e746572732f6a737072696e746572...]
Hypertext Transfer Protocol
    POST /printers/jsprinter HTTP/1.1\r\n
        [Expert Info (Chat/Sequence): POST /printers/jsprinter HTTP/1.1\r\n]
            [POST /printers/jsprinter HTTP/1.1\r\n]
            [Severity level: Chat]
            [Group: Sequence]
        Request Method: POST
        Request URI: /printers/jsprinter
        Request Version: HTTP/1.1
    Connection: Keep-Alive\r\n
    Content-Type: application/ipp\r\n
    User-Agent: Internet Print Provider\r\n
    Content-Length: 136\r\n
        [Content length: 136]
    Host: 192.168.0.111:40023\r\n
    \r\n
    [Full request URI: http://192.168.0.111:40023/printers/jsprinter]
    [HTTP request 1/1]
    [Response in frame: 8]
Internet Printing Protocol
    Version: 1.0
    Status-code: Successful (0x804x)
    Request ID: 11
    Operation attributes
        attributes-charset: utf-8
            Tag: Character set
            Name length: 18
            Name: attributes-charset
            Value length: 5
            Value: utf-8
        attributes-natural-language: en-us
            Tag: Natural language
            Name length: 27
            Name: attributes-natural-language
            Value length: 5
            Value: en-us
        printer-uri: http://192.168.0.111:40023/printers/jsprinter
            Tag: URI
            Name length: 11
            Name: printer-uri
            Value length: 45
            Value: http://192.168.0.111:40023/printers/jsprinter
    End of attributes

No.     Time           Source                Destination           Protocol Length Info
      7 0.003742901    192.168.0.111         192.168.0.106         TCP      54     40023 → 59251 [ACK] Seq=1 Ack=314 Win=31360 Len=0

Frame 7: 54 bytes on wire (432 bits), 54 bytes captured (432 bits) on interface 0
    Interface id: 0 (wlp1s0)
    Encapsulation type: Ethernet (1)
    Arrival Time: Nov 26, 2015 00:37:35.272547522 EST
    [Time shift for this packet: 0.000000000 seconds]
    Epoch Time: 1448516255.272547522 seconds
    [Time delta from previous captured frame: 0.000018193 seconds]
    [Time delta from previous displayed frame: 0.000018193 seconds]
    [Time since reference or first frame: 0.003742901 seconds]
    Frame Number: 7
    Frame Length: 54 bytes (432 bits)
    Capture Length: 54 bytes (432 bits)
    [Frame is marked: False]
    [Frame is ignored: False]
    [Protocols in frame: eth:ethertype:ip:tcp]
    [Coloring Rule Name: TCP]
    [Coloring Rule String: tcp]
Ethernet II, Src: HonHaiPr_f1:8a:fd (2c:33:7a:f1:8a:fd), Dst: HonHaiPr_f1:8c:bb (2c:33:7a:f1:8c:bb)
    Destination: HonHaiPr_f1:8c:bb (2c:33:7a:f1:8c:bb)
        Address: HonHaiPr_f1:8c:bb (2c:33:7a:f1:8c:bb)
        .... ..0. .... .... .... .... = LG bit: Globally unique address (factory default)
        .... ...0 .... .... .... .... = IG bit: Individual address (unicast)
    Source: HonHaiPr_f1:8a:fd (2c:33:7a:f1:8a:fd)
        Address: HonHaiPr_f1:8a:fd (2c:33:7a:f1:8a:fd)
        .... ..0. .... .... .... .... = LG bit: Globally unique address (factory default)
        .... ...0 .... .... .... .... = IG bit: Individual address (unicast)
    Type: IPv4 (0x0800)
Internet Protocol Version 4, Src: 192.168.0.111, Dst: 192.168.0.106
    0100 .... = Version: 4
    .... 0101 = Header Length: 20 bytes
    Differentiated Services Field: 0x00 (DSCP: CS0, ECN: Not-ECT)
        0000 00.. = Differentiated Services Codepoint: Default (0)
        .... ..00 = Explicit Congestion Notification: Not ECN-Capable Transport (0)
    Total Length: 40
    Identification: 0x1de0 (7648)
    Flags: 0x02 (Don't Fragment)
        0... .... = Reserved bit: Not set
        .1.. .... = Don't fragment: Set
        ..0. .... = More fragments: Not set
    Fragment offset: 0
    Time to live: 64
    Protocol: TCP (6)
    Header checksum: 0x9ac6 [validation disabled]
        [Good: False]
        [Bad: False]
    Source: 192.168.0.111
    Destination: 192.168.0.106
Transmission Control Protocol, Src Port: 40023 (40023), Dst Port: 59251 (59251), Seq: 1, Ack: 314, Len: 0
    Source Port: 40023
    Destination Port: 59251
    [Stream index: 0]
    [TCP Segment Len: 0]
    Sequence number: 1    (relative sequence number)
    Acknowledgment number: 314    (relative ack number)
    Header Length: 20 bytes
    Flags: 0x010 (ACK)
        000. .... .... = Reserved: Not set
        ...0 .... .... = Nonce: Not set
        .... 0... .... = Congestion Window Reduced (CWR): Not set
        .... .0.. .... = ECN-Echo: Not set
        .... ..0. .... = Urgent: Not set
        .... ...1 .... = Acknowledgment: Set
        .... .... 0... = Push: Not set
        .... .... .0.. = Reset: Not set
        .... .... ..0. = Syn: Not set
        .... .... ...0 = Fin: Not set
        [TCP Flags: *******A****]
    Window size value: 245
    [Calculated window size: 31360]
    [Window size scaling factor: 128]
    Checksum: 0x1c07 [validation disabled]
        [Good Checksum: False]
        [Bad Checksum: False]
    Urgent pointer: 0
    [SEQ/ACK analysis]
        [This is an ACK to the segment in frame: 6]
        [The RTT to ACK the segment was: 0.000018193 seconds]
        [iRTT: 0.002515157 seconds]

No.     Time           Source                Destination           Protocol Length Info
      8 0.007530345    192.168.0.111         192.168.0.106         IPP      304    IPP response

Frame 8: 304 bytes on wire (2432 bits), 304 bytes captured (2432 bits) on interface 0
    Interface id: 0 (wlp1s0)
    Encapsulation type: Ethernet (1)
    Arrival Time: Nov 26, 2015 00:37:35.276334966 EST
    [Time shift for this packet: 0.000000000 seconds]
    Epoch Time: 1448516255.276334966 seconds
    [Time delta from previous captured frame: 0.003787444 seconds]
    [Time delta from previous displayed frame: 0.003787444 seconds]
    [Time since reference or first frame: 0.007530345 seconds]
    Frame Number: 8
    Frame Length: 304 bytes (2432 bits)
    Capture Length: 304 bytes (2432 bits)
    [Frame is marked: False]
    [Frame is ignored: False]
    [Protocols in frame: eth:ethertype:ip:tcp:http:ipp]
    [Coloring Rule Name: HTTP]
    [Coloring Rule String: http || tcp.port == 80 || http2]
Ethernet II, Src: HonHaiPr_f1:8a:fd (2c:33:7a:f1:8a:fd), Dst: HonHaiPr_f1:8c:bb (2c:33:7a:f1:8c:bb)
    Destination: HonHaiPr_f1:8c:bb (2c:33:7a:f1:8c:bb)
        Address: HonHaiPr_f1:8c:bb (2c:33:7a:f1:8c:bb)
        .... ..0. .... .... .... .... = LG bit: Globally unique address (factory default)
        .... ...0 .... .... .... .... = IG bit: Individual address (unicast)
    Source: HonHaiPr_f1:8a:fd (2c:33:7a:f1:8a:fd)
        Address: HonHaiPr_f1:8a:fd (2c:33:7a:f1:8a:fd)
        .... ..0. .... .... .... .... = LG bit: Globally unique address (factory default)
        .... ...0 .... .... .... .... = IG bit: Individual address (unicast)
    Type: IPv4 (0x0800)
Internet Protocol Version 4, Src: 192.168.0.111, Dst: 192.168.0.106
    0100 .... = Version: 4
    .... 0101 = Header Length: 20 bytes
    Differentiated Services Field: 0x00 (DSCP: CS0, ECN: Not-ECT)
        0000 00.. = Differentiated Services Codepoint: Default (0)
        .... ..00 = Explicit Congestion Notification: Not ECN-Capable Transport (0)
    Total Length: 290
    Identification: 0x1de1 (7649)
    Flags: 0x02 (Don't Fragment)
        0... .... = Reserved bit: Not set
        .1.. .... = Don't fragment: Set
        ..0. .... = More fragments: Not set
    Fragment offset: 0
    Time to live: 64
    Protocol: TCP (6)
    Header checksum: 0x99cb [validation disabled]
        [Good: False]
        [Bad: False]
    Source: 192.168.0.111
    Destination: 192.168.0.106
Transmission Control Protocol, Src Port: 40023 (40023), Dst Port: 59251 (59251), Seq: 1, Ack: 314, Len: 250
    Source Port: 40023
    Destination Port: 59251
    [Stream index: 0]
    [TCP Segment Len: 250]
    Sequence number: 1    (relative sequence number)
    [Next sequence number: 251    (relative sequence number)]
    Acknowledgment number: 314    (relative ack number)
    Header Length: 20 bytes
    Flags: 0x018 (PSH, ACK)
        000. .... .... = Reserved: Not set
        ...0 .... .... = Nonce: Not set
        .... 0... .... = Congestion Window Reduced (CWR): Not set
        .... .0.. .... = ECN-Echo: Not set
        .... ..0. .... = Urgent: Not set
        .... ...1 .... = Acknowledgment: Set
        .... .... 1... = Push: Set
        .... .... .0.. = Reset: Not set
        .... .... ..0. = Syn: Not set
        .... .... ...0 = Fin: Not set
        [TCP Flags: *******AP***]
    Window size value: 245
    [Calculated window size: 31360]
    [Window size scaling factor: 128]
    Checksum: 0x56fd [validation disabled]
        [Good Checksum: False]
        [Bad Checksum: False]
    Urgent pointer: 0
    [SEQ/ACK analysis]
        [iRTT: 0.002515157 seconds]
        [Bytes in flight: 250]
Hypertext Transfer Protocol
    HTTP/1.1 200 OK\r\n
        [Expert Info (Chat/Sequence): HTTP/1.1 200 OK\r\n]
            [HTTP/1.1 200 OK\r\n]
            [Severity level: Chat]
            [Group: Sequence]
        Request Version: HTTP/1.1
        Status Code: 200
        Response Phrase: OK
    Content-Length: 118\r\n
        [Content length: 118]
    Content-Type: application/ipp\r\n
    Date: Thu, 26 Nov 2015 05:37:35 GMT\r\n
    Connection: keep-alive\r\n
    \r\n
    [HTTP response 1/1]
    [Time since request: 0.003805637 seconds]
    [Request in frame: 6]
Internet Printing Protocol
    Version: 1.1
    Status-code: Successful (Successful-OK)
    Request ID: 11
    Operation attributes
        attributes-charset: utf-8
            Tag: Character set
            Name length: 18
            Name: attributes-charset
            Value length: 5
            Value: utf-8
        attributes-natural-language: en-us
            Tag: Natural language
            Name length: 27
            Name: attributes-natural-language
            Value length: 5
            Value: en-us
        status-message: 0005656e2d7573000d7375636365737366756c2d6f6b
            Tag: Text with language
            Name length: 14
            Name: status-message
            Value length: 22
            Value: 0005656e2d7573000d7375636365737366756c2d6f6b
    Unsupported attributes
    Printer attributes
    End of attributes

No.     Time           Source                Destination           Protocol Length Info
      9 0.014712017    192.168.0.106         192.168.0.111         TCP      66     59252 → 40023 [SYN] Seq=0 Win=8192 Len=0 MSS=1460 WS=256 SACK_PERM=1

Frame 9: 66 bytes on wire (528 bits), 66 bytes captured (528 bits) on interface 0
    Interface id: 0 (wlp1s0)
    Encapsulation type: Ethernet (1)
    Arrival Time: Nov 26, 2015 00:37:35.283516638 EST
    [Time shift for this packet: 0.000000000 seconds]
    Epoch Time: 1448516255.283516638 seconds
    [Time delta from previous captured frame: 0.007181672 seconds]
    [Time delta from previous displayed frame: 0.007181672 seconds]
    [Time since reference or first frame: 0.014712017 seconds]
    Frame Number: 9
    Frame Length: 66 bytes (528 bits)
    Capture Length: 66 bytes (528 bits)
    [Frame is marked: False]
    [Frame is ignored: False]
    [Protocols in frame: eth:ethertype:ip:tcp]
    [Coloring Rule Name: TCP SYN/FIN]
    [Coloring Rule String: tcp.flags & 0x02 || tcp.flags.fin == 1]
Ethernet II, Src: HonHaiPr_f1:8c:bb (2c:33:7a:f1:8c:bb), Dst: HonHaiPr_f1:8a:fd (2c:33:7a:f1:8a:fd)
    Destination: HonHaiPr_f1:8a:fd (2c:33:7a:f1:8a:fd)
        Address: HonHaiPr_f1:8a:fd (2c:33:7a:f1:8a:fd)
        .... ..0. .... .... .... .... = LG bit: Globally unique address (factory default)
        .... ...0 .... .... .... .... = IG bit: Individual address (unicast)
    Source: HonHaiPr_f1:8c:bb (2c:33:7a:f1:8c:bb)
        Address: HonHaiPr_f1:8c:bb (2c:33:7a:f1:8c:bb)
        .... ..0. .... .... .... .... = LG bit: Globally unique address (factory default)
        .... ...0 .... .... .... .... = IG bit: Individual address (unicast)
    Type: IPv4 (0x0800)
Internet Protocol Version 4, Src: 192.168.0.106, Dst: 192.168.0.111
    0100 .... = Version: 4
    .... 0101 = Header Length: 20 bytes
    Differentiated Services Field: 0x00 (DSCP: CS0, ECN: Not-ECT)
        0000 00.. = Differentiated Services Codepoint: Default (0)
        .... ..00 = Explicit Congestion Notification: Not ECN-Capable Transport (0)
    Total Length: 52
    Identification: 0x6bf4 (27636)
    Flags: 0x02 (Don't Fragment)
        0... .... = Reserved bit: Not set
        .1.. .... = Don't fragment: Set
        ..0. .... = More fragments: Not set
    Fragment offset: 0
    Time to live: 128
    Protocol: TCP (6)
    Header checksum: 0x0ca6 [validation disabled]
        [Good: False]
        [Bad: False]
    Source: 192.168.0.106
    Destination: 192.168.0.111
Transmission Control Protocol, Src Port: 59252 (59252), Dst Port: 40023 (40023), Seq: 0, Len: 0
    Source Port: 59252
    Destination Port: 40023
    [Stream index: 1]
    [TCP Segment Len: 0]
    Sequence number: 0    (relative sequence number)
    Acknowledgment number: 0
    Header Length: 32 bytes
    Flags: 0x002 (SYN)
        000. .... .... = Reserved: Not set
        ...0 .... .... = Nonce: Not set
        .... 0... .... = Congestion Window Reduced (CWR): Not set
        .... .0.. .... = ECN-Echo: Not set
        .... ..0. .... = Urgent: Not set
        .... ...0 .... = Acknowledgment: Not set
        .... .... 0... = Push: Not set
        .... .... .0.. = Reset: Not set
        .... .... ..1. = Syn: Set
            [Expert Info (Chat/Sequence): Connection establish request (SYN): server port 40023]
                [Connection establish request (SYN): server port 40023]
                [Severity level: Chat]
                [Group: Sequence]
        .... .... ...0 = Fin: Not set
        [TCP Flags: **********S*]
    Window size value: 8192
    [Calculated window size: 8192]
    Checksum: 0x2412 [validation disabled]
        [Good Checksum: False]
        [Bad Checksum: False]
    Urgent pointer: 0
    Options: (12 bytes), Maximum segment size, No-Operation (NOP), Window scale, No-Operation (NOP), No-Operation (NOP), SACK permitted
        Maximum segment size: 1460 bytes
            Kind: Maximum Segment Size (2)
            Length: 4
            MSS Value: 1460
        No-Operation (NOP)
            Type: 1
                0... .... = Copy on fragmentation: No
                .00. .... = Class: Control (0)
                ...0 0001 = Number: No-Operation (NOP) (1)
        Window scale: 8 (multiply by 256)
            Kind: Window Scale (3)
            Length: 3
            Shift count: 8
            [Multiplier: 256]
        No-Operation (NOP)
            Type: 1
                0... .... = Copy on fragmentation: No
                .00. .... = Class: Control (0)
                ...0 0001 = Number: No-Operation (NOP) (1)
        No-Operation (NOP)
            Type: 1
                0... .... = Copy on fragmentation: No
                .00. .... = Class: Control (0)
                ...0 0001 = Number: No-Operation (NOP) (1)
        TCP SACK Permitted Option: True
            Kind: SACK Permitted (4)
            Length: 2

No.     Time           Source                Destination           Protocol Length Info
     10 0.014786324    192.168.0.111         192.168.0.106         TCP      66     40023 → 59252 [SYN, ACK] Seq=0 Ack=1 Win=29200 Len=0 MSS=1460 SACK_PERM=1 WS=128

Frame 10: 66 bytes on wire (528 bits), 66 bytes captured (528 bits) on interface 0
    Interface id: 0 (wlp1s0)
    Encapsulation type: Ethernet (1)
    Arrival Time: Nov 26, 2015 00:37:35.283590945 EST
    [Time shift for this packet: 0.000000000 seconds]
    Epoch Time: 1448516255.283590945 seconds
    [Time delta from previous captured frame: 0.000074307 seconds]
    [Time delta from previous displayed frame: 0.000074307 seconds]
    [Time since reference or first frame: 0.014786324 seconds]
    Frame Number: 10
    Frame Length: 66 bytes (528 bits)
    Capture Length: 66 bytes (528 bits)
    [Frame is marked: False]
    [Frame is ignored: False]
    [Protocols in frame: eth:ethertype:ip:tcp]
    [Coloring Rule Name: TCP SYN/FIN]
    [Coloring Rule String: tcp.flags & 0x02 || tcp.flags.fin == 1]
Ethernet II, Src: HonHaiPr_f1:8a:fd (2c:33:7a:f1:8a:fd), Dst: HonHaiPr_f1:8c:bb (2c:33:7a:f1:8c:bb)
    Destination: HonHaiPr_f1:8c:bb (2c:33:7a:f1:8c:bb)
        Address: HonHaiPr_f1:8c:bb (2c:33:7a:f1:8c:bb)
        .... ..0. .... .... .... .... = LG bit: Globally unique address (factory default)
        .... ...0 .... .... .... .... = IG bit: Individual address (unicast)
    Source: HonHaiPr_f1:8a:fd (2c:33:7a:f1:8a:fd)
        Address: HonHaiPr_f1:8a:fd (2c:33:7a:f1:8a:fd)
        .... ..0. .... .... .... .... = LG bit: Globally unique address (factory default)
        .... ...0 .... .... .... .... = IG bit: Individual address (unicast)
    Type: IPv4 (0x0800)
Internet Protocol Version 4, Src: 192.168.0.111, Dst: 192.168.0.106
    0100 .... = Version: 4
    .... 0101 = Header Length: 20 bytes
    Differentiated Services Field: 0x00 (DSCP: CS0, ECN: Not-ECT)
        0000 00.. = Differentiated Services Codepoint: Default (0)
        .... ..00 = Explicit Congestion Notification: Not ECN-Capable Transport (0)
    Total Length: 52
    Identification: 0x0000 (0)
    Flags: 0x02 (Don't Fragment)
        0... .... = Reserved bit: Not set
        .1.. .... = Don't fragment: Set
        ..0. .... = More fragments: Not set
    Fragment offset: 0
    Time to live: 64
    Protocol: TCP (6)
    Header checksum: 0xb89a [validation disabled]
        [Good: False]
        [Bad: False]
    Source: 192.168.0.111
    Destination: 192.168.0.106
Transmission Control Protocol, Src Port: 40023 (40023), Dst Port: 59252 (59252), Seq: 0, Ack: 1, Len: 0
    Source Port: 40023
    Destination Port: 59252
    [Stream index: 1]
    [TCP Segment Len: 0]
    Sequence number: 0    (relative sequence number)
    Acknowledgment number: 1    (relative ack number)
    Header Length: 32 bytes
    Flags: 0x012 (SYN, ACK)
        000. .... .... = Reserved: Not set
        ...0 .... .... = Nonce: Not set
        .... 0... .... = Congestion Window Reduced (CWR): Not set
        .... .0.. .... = ECN-Echo: Not set
        .... ..0. .... = Urgent: Not set
        .... ...1 .... = Acknowledgment: Set
        .... .... 0... = Push: Not set
        .... .... .0.. = Reset: Not set
        .... .... ..1. = Syn: Set
            [Expert Info (Chat/Sequence): Connection establish acknowledge (SYN+ACK): server port 40023]
                [Connection establish acknowledge (SYN+ACK): server port 40023]
                [Severity level: Chat]
                [Group: Sequence]
        .... .... ...0 = Fin: Not set
        [TCP Flags: *******A**S*]
    Window size value: 29200
    [Calculated window size: 29200]
    Checksum: 0x3aa7 [validation disabled]
        [Good Checksum: False]
        [Bad Checksum: False]
    Urgent pointer: 0
    Options: (12 bytes), Maximum segment size, No-Operation (NOP), No-Operation (NOP), SACK permitted, No-Operation (NOP), Window scale
        Maximum segment size: 1460 bytes
            Kind: Maximum Segment Size (2)
            Length: 4
            MSS Value: 1460
        No-Operation (NOP)
            Type: 1
                0... .... = Copy on fragmentation: No
                .00. .... = Class: Control (0)
                ...0 0001 = Number: No-Operation (NOP) (1)
        No-Operation (NOP)
            Type: 1
                0... .... = Copy on fragmentation: No
                .00. .... = Class: Control (0)
                ...0 0001 = Number: No-Operation (NOP) (1)
        TCP SACK Permitted Option: True
            Kind: SACK Permitted (4)
            Length: 2
        No-Operation (NOP)
            Type: 1
                0... .... = Copy on fragmentation: No
                .00. .... = Class: Control (0)
                ...0 0001 = Number: No-Operation (NOP) (1)
        Window scale: 7 (multiply by 128)
            Kind: Window Scale (3)
            Length: 3
            Shift count: 7
            [Multiplier: 128]
    [SEQ/ACK analysis]
        [This is an ACK to the segment in frame: 9]
        [The RTT to ACK the segment was: 0.000074307 seconds]
        [iRTT: 0.002306594 seconds]

No.     Time           Source                Destination           Protocol Length Info
     11 0.017018611    192.168.0.106         192.168.0.111         TCP      54     59252 → 40023 [ACK] Seq=1 Ack=1 Win=65536 Len=0

Frame 11: 54 bytes on wire (432 bits), 54 bytes captured (432 bits) on interface 0
    Interface id: 0 (wlp1s0)
    Encapsulation type: Ethernet (1)
    Arrival Time: Nov 26, 2015 00:37:35.285823232 EST
    [Time shift for this packet: 0.000000000 seconds]
    Epoch Time: 1448516255.285823232 seconds
    [Time delta from previous captured frame: 0.002232287 seconds]
    [Time delta from previous displayed frame: 0.002232287 seconds]
    [Time since reference or first frame: 0.017018611 seconds]
    Frame Number: 11
    Frame Length: 54 bytes (432 bits)
    Capture Length: 54 bytes (432 bits)
    [Frame is marked: False]
    [Frame is ignored: False]
    [Protocols in frame: eth:ethertype:ip:tcp]
    [Coloring Rule Name: TCP]
    [Coloring Rule String: tcp]
Ethernet II, Src: HonHaiPr_f1:8c:bb (2c:33:7a:f1:8c:bb), Dst: HonHaiPr_f1:8a:fd (2c:33:7a:f1:8a:fd)
    Destination: HonHaiPr_f1:8a:fd (2c:33:7a:f1:8a:fd)
        Address: HonHaiPr_f1:8a:fd (2c:33:7a:f1:8a:fd)
        .... ..0. .... .... .... .... = LG bit: Globally unique address (factory default)
        .... ...0 .... .... .... .... = IG bit: Individual address (unicast)
    Source: HonHaiPr_f1:8c:bb (2c:33:7a:f1:8c:bb)
        Address: HonHaiPr_f1:8c:bb (2c:33:7a:f1:8c:bb)
        .... ..0. .... .... .... .... = LG bit: Globally unique address (factory default)
        .... ...0 .... .... .... .... = IG bit: Individual address (unicast)
    Type: IPv4 (0x0800)
Internet Protocol Version 4, Src: 192.168.0.106, Dst: 192.168.0.111
    0100 .... = Version: 4
    .... 0101 = Header Length: 20 bytes
    Differentiated Services Field: 0x00 (DSCP: CS0, ECN: Not-ECT)
        0000 00.. = Differentiated Services Codepoint: Default (0)
        .... ..00 = Explicit Congestion Notification: Not ECN-Capable Transport (0)
    Total Length: 40
    Identification: 0x6bf5 (27637)
    Flags: 0x02 (Don't Fragment)
        0... .... = Reserved bit: Not set
        .1.. .... = Don't fragment: Set
        ..0. .... = More fragments: Not set
    Fragment offset: 0
    Time to live: 128
    Protocol: TCP (6)
    Header checksum: 0x0cb1 [validation disabled]
        [Good: False]
        [Bad: False]
    Source: 192.168.0.106
    Destination: 192.168.0.111
Transmission Control Protocol, Src Port: 59252 (59252), Dst Port: 40023 (40023), Seq: 1, Ack: 1, Len: 0
    Source Port: 59252
    Destination Port: 40023
    [Stream index: 1]
    [TCP Segment Len: 0]
    Sequence number: 1    (relative sequence number)
    Acknowledgment number: 1    (relative ack number)
    Header Length: 20 bytes
    Flags: 0x010 (ACK)
        000. .... .... = Reserved: Not set
        ...0 .... .... = Nonce: Not set
        .... 0... .... = Congestion Window Reduced (CWR): Not set
        .... .0.. .... = ECN-Echo: Not set
        .... ..0. .... = Urgent: Not set
        .... ...1 .... = Acknowledgment: Set
        .... .... 0... = Push: Not set
        .... .... .0.. = Reset: Not set
        .... .... ..0. = Syn: Not set
        .... .... ...0 = Fin: Not set
        [TCP Flags: *******A****]
    Window size value: 256
    [Calculated window size: 65536]
    [Window size scaling factor: 256]
    Checksum: 0xec89 [validation disabled]
        [Good Checksum: False]
        [Bad Checksum: False]
    Urgent pointer: 0
    [SEQ/ACK analysis]
        [This is an ACK to the segment in frame: 10]
        [The RTT to ACK the segment was: 0.002232287 seconds]
        [iRTT: 0.002306594 seconds]

No.     Time           Source                Destination           Protocol Length Info
     12 0.017689050    192.168.0.106         192.168.0.111         TCP      231    [TCP segment of a reassembled PDU]

Frame 12: 231 bytes on wire (1848 bits), 231 bytes captured (1848 bits) on interface 0
    Interface id: 0 (wlp1s0)
    Encapsulation type: Ethernet (1)
    Arrival Time: Nov 26, 2015 00:37:35.286493671 EST
    [Time shift for this packet: 0.000000000 seconds]
    Epoch Time: 1448516255.286493671 seconds
    [Time delta from previous captured frame: 0.000670439 seconds]
    [Time delta from previous displayed frame: 0.000670439 seconds]
    [Time since reference or first frame: 0.017689050 seconds]
    Frame Number: 12
    Frame Length: 231 bytes (1848 bits)
    Capture Length: 231 bytes (1848 bits)
    [Frame is marked: False]
    [Frame is ignored: False]
    [Protocols in frame: eth:ethertype:ip:tcp]
    [Coloring Rule Name: TCP]
    [Coloring Rule String: tcp]
Ethernet II, Src: HonHaiPr_f1:8c:bb (2c:33:7a:f1:8c:bb), Dst: HonHaiPr_f1:8a:fd (2c:33:7a:f1:8a:fd)
    Destination: HonHaiPr_f1:8a:fd (2c:33:7a:f1:8a:fd)
        Address: HonHaiPr_f1:8a:fd (2c:33:7a:f1:8a:fd)
        .... ..0. .... .... .... .... = LG bit: Globally unique address (factory default)
        .... ...0 .... .... .... .... = IG bit: Individual address (unicast)
    Source: HonHaiPr_f1:8c:bb (2c:33:7a:f1:8c:bb)
        Address: HonHaiPr_f1:8c:bb (2c:33:7a:f1:8c:bb)
        .... ..0. .... .... .... .... = LG bit: Globally unique address (factory default)
        .... ...0 .... .... .... .... = IG bit: Individual address (unicast)
    Type: IPv4 (0x0800)
Internet Protocol Version 4, Src: 192.168.0.106, Dst: 192.168.0.111
    0100 .... = Version: 4
    .... 0101 = Header Length: 20 bytes
    Differentiated Services Field: 0x00 (DSCP: CS0, ECN: Not-ECT)
        0000 00.. = Differentiated Services Codepoint: Default (0)
        .... ..00 = Explicit Congestion Notification: Not ECN-Capable Transport (0)
    Total Length: 217
    Identification: 0x6bf6 (27638)
    Flags: 0x02 (Don't Fragment)
        0... .... = Reserved bit: Not set
        .1.. .... = Don't fragment: Set
        ..0. .... = More fragments: Not set
    Fragment offset: 0
    Time to live: 128
    Protocol: TCP (6)
    Header checksum: 0x0bff [validation disabled]
        [Good: False]
        [Bad: False]
    Source: 192.168.0.106
    Destination: 192.168.0.111
Transmission Control Protocol, Src Port: 59252 (59252), Dst Port: 40023 (40023), Seq: 1, Ack: 1, Len: 177
    Source Port: 59252
    Destination Port: 40023
    [Stream index: 1]
    [TCP Segment Len: 177]
    Sequence number: 1    (relative sequence number)
    [Next sequence number: 178    (relative sequence number)]
    Acknowledgment number: 1    (relative ack number)
    Header Length: 20 bytes
    Flags: 0x018 (PSH, ACK)
        000. .... .... = Reserved: Not set
        ...0 .... .... = Nonce: Not set
        .... 0... .... = Congestion Window Reduced (CWR): Not set
        .... .0.. .... = ECN-Echo: Not set
        .... ..0. .... = Urgent: Not set
        .... ...1 .... = Acknowledgment: Set
        .... .... 1... = Push: Set
        .... .... .0.. = Reset: Not set
        .... .... ..0. = Syn: Not set
        .... .... ...0 = Fin: Not set
        [TCP Flags: *******AP***]
    Window size value: 256
    [Calculated window size: 65536]
    [Window size scaling factor: 256]
    Checksum: 0x453f [validation disabled]
        [Good Checksum: False]
        [Bad Checksum: False]
    Urgent pointer: 0
    [SEQ/ACK analysis]
        [iRTT: 0.002306594 seconds]
        [Bytes in flight: 177]
    TCP segment data (177 bytes)

No.     Time           Source                Destination           Protocol Length Info
     13 0.017726134    192.168.0.111         192.168.0.106         TCP      54     40023 → 59252 [ACK] Seq=1 Ack=178 Win=30336 Len=0

Frame 13: 54 bytes on wire (432 bits), 54 bytes captured (432 bits) on interface 0
    Interface id: 0 (wlp1s0)
    Encapsulation type: Ethernet (1)
    Arrival Time: Nov 26, 2015 00:37:35.286530755 EST
    [Time shift for this packet: 0.000000000 seconds]
    Epoch Time: 1448516255.286530755 seconds
    [Time delta from previous captured frame: 0.000037084 seconds]
    [Time delta from previous displayed frame: 0.000037084 seconds]
    [Time since reference or first frame: 0.017726134 seconds]
    Frame Number: 13
    Frame Length: 54 bytes (432 bits)
    Capture Length: 54 bytes (432 bits)
    [Frame is marked: False]
    [Frame is ignored: False]
    [Protocols in frame: eth:ethertype:ip:tcp]
    [Coloring Rule Name: TCP]
    [Coloring Rule String: tcp]
Ethernet II, Src: HonHaiPr_f1:8a:fd (2c:33:7a:f1:8a:fd), Dst: HonHaiPr_f1:8c:bb (2c:33:7a:f1:8c:bb)
    Destination: HonHaiPr_f1:8c:bb (2c:33:7a:f1:8c:bb)
        Address: HonHaiPr_f1:8c:bb (2c:33:7a:f1:8c:bb)
        .... ..0. .... .... .... .... = LG bit: Globally unique address (factory default)
        .... ...0 .... .... .... .... = IG bit: Individual address (unicast)
    Source: HonHaiPr_f1:8a:fd (2c:33:7a:f1:8a:fd)
        Address: HonHaiPr_f1:8a:fd (2c:33:7a:f1:8a:fd)
        .... ..0. .... .... .... .... = LG bit: Globally unique address (factory default)
        .... ...0 .... .... .... .... = IG bit: Individual address (unicast)
    Type: IPv4 (0x0800)
Internet Protocol Version 4, Src: 192.168.0.111, Dst: 192.168.0.106
    0100 .... = Version: 4
    .... 0101 = Header Length: 20 bytes
    Differentiated Services Field: 0x00 (DSCP: CS0, ECN: Not-ECT)
        0000 00.. = Differentiated Services Codepoint: Default (0)
        .... ..00 = Explicit Congestion Notification: Not ECN-Capable Transport (0)
    Total Length: 40
    Identification: 0x6d79 (28025)
    Flags: 0x02 (Don't Fragment)
        0... .... = Reserved bit: Not set
        .1.. .... = Don't fragment: Set
        ..0. .... = More fragments: Not set
    Fragment offset: 0
    Time to live: 64
    Protocol: TCP (6)
    Header checksum: 0x4b2d [validation disabled]
        [Good: False]
        [Bad: False]
    Source: 192.168.0.111
    Destination: 192.168.0.106
Transmission Control Protocol, Src Port: 40023 (40023), Dst Port: 59252 (59252), Seq: 1, Ack: 178, Len: 0
    Source Port: 40023
    Destination Port: 59252
    [Stream index: 1]
    [TCP Segment Len: 0]
    Sequence number: 1    (relative sequence number)
    Acknowledgment number: 178    (relative ack number)
    Header Length: 20 bytes
    Flags: 0x010 (ACK)
        000. .... .... = Reserved: Not set
        ...0 .... .... = Nonce: Not set
        .... 0... .... = Congestion Window Reduced (CWR): Not set
        .... .0.. .... = ECN-Echo: Not set
        .... ..0. .... = Urgent: Not set
        .... ...1 .... = Acknowledgment: Set
        .... .... 0... = Push: Not set
        .... .... .0.. = Reset: Not set
        .... .... ..0. = Syn: Not set
        .... .... ...0 = Fin: Not set
        [TCP Flags: *******A****]
    Window size value: 237
    [Calculated window size: 30336]
    [Window size scaling factor: 128]
    Checksum: 0xebeb [validation disabled]
        [Good Checksum: False]
        [Bad Checksum: False]
    Urgent pointer: 0
    [SEQ/ACK analysis]
        [This is an ACK to the segment in frame: 12]
        [The RTT to ACK the segment was: 0.000037084 seconds]
        [iRTT: 0.002306594 seconds]

No.     Time           Source                Destination           Protocol Length Info
     14 0.018348336    192.168.0.106         192.168.0.111         IPP      190    IPP response

Frame 14: 190 bytes on wire (1520 bits), 190 bytes captured (1520 bits) on interface 0
    Interface id: 0 (wlp1s0)
    Encapsulation type: Ethernet (1)
    Arrival Time: Nov 26, 2015 00:37:35.287152957 EST
    [Time shift for this packet: 0.000000000 seconds]
    Epoch Time: 1448516255.287152957 seconds
    [Time delta from previous captured frame: 0.000622202 seconds]
    [Time delta from previous displayed frame: 0.000622202 seconds]
    [Time since reference or first frame: 0.018348336 seconds]
    Frame Number: 14
    Frame Length: 190 bytes (1520 bits)
    Capture Length: 190 bytes (1520 bits)
    [Frame is marked: False]
    [Frame is ignored: False]
    [Protocols in frame: eth:ethertype:ip:tcp:http:ipp]
    [Coloring Rule Name: HTTP]
    [Coloring Rule String: http || tcp.port == 80 || http2]
Ethernet II, Src: HonHaiPr_f1:8c:bb (2c:33:7a:f1:8c:bb), Dst: HonHaiPr_f1:8a:fd (2c:33:7a:f1:8a:fd)
    Destination: HonHaiPr_f1:8a:fd (2c:33:7a:f1:8a:fd)
        Address: HonHaiPr_f1:8a:fd (2c:33:7a:f1:8a:fd)
        .... ..0. .... .... .... .... = LG bit: Globally unique address (factory default)
        .... ...0 .... .... .... .... = IG bit: Individual address (unicast)
    Source: HonHaiPr_f1:8c:bb (2c:33:7a:f1:8c:bb)
        Address: HonHaiPr_f1:8c:bb (2c:33:7a:f1:8c:bb)
        .... ..0. .... .... .... .... = LG bit: Globally unique address (factory default)
        .... ...0 .... .... .... .... = IG bit: Individual address (unicast)
    Type: IPv4 (0x0800)
Internet Protocol Version 4, Src: 192.168.0.106, Dst: 192.168.0.111
    0100 .... = Version: 4
    .... 0101 = Header Length: 20 bytes
    Differentiated Services Field: 0x00 (DSCP: CS0, ECN: Not-ECT)
        0000 00.. = Differentiated Services Codepoint: Default (0)
        .... ..00 = Explicit Congestion Notification: Not ECN-Capable Transport (0)
    Total Length: 176
    Identification: 0x6bf7 (27639)
    Flags: 0x02 (Don't Fragment)
        0... .... = Reserved bit: Not set
        .1.. .... = Don't fragment: Set
        ..0. .... = More fragments: Not set
    Fragment offset: 0
    Time to live: 128
    Protocol: TCP (6)
    Header checksum: 0x0c27 [validation disabled]
        [Good: False]
        [Bad: False]
    Source: 192.168.0.106
    Destination: 192.168.0.111
Transmission Control Protocol, Src Port: 59252 (59252), Dst Port: 40023 (40023), Seq: 178, Ack: 1, Len: 136
    Source Port: 59252
    Destination Port: 40023
    [Stream index: 1]
    [TCP Segment Len: 136]
    Sequence number: 178    (relative sequence number)
    [Next sequence number: 314    (relative sequence number)]
    Acknowledgment number: 1    (relative ack number)
    Header Length: 20 bytes
    Flags: 0x018 (PSH, ACK)
        000. .... .... = Reserved: Not set
        ...0 .... .... = Nonce: Not set
        .... 0... .... = Congestion Window Reduced (CWR): Not set
        .... .0.. .... = ECN-Echo: Not set
        .... ..0. .... = Urgent: Not set
        .... ...1 .... = Acknowledgment: Set
        .... .... 1... = Push: Set
        .... .... .0.. = Reset: Not set
        .... .... ..0. = Syn: Not set
        .... .... ...0 = Fin: Not set
        [TCP Flags: *******AP***]
    Window size value: 256
    [Calculated window size: 65536]
    [Window size scaling factor: 256]
    Checksum: 0xcebd [validation disabled]
        [Good Checksum: False]
        [Bad Checksum: False]
    Urgent pointer: 0
    [SEQ/ACK analysis]
        [iRTT: 0.002306594 seconds]
        [Bytes in flight: 136]
    TCP segment data (136 bytes)
[2 Reassembled TCP Segments (313 bytes): #12(177), #14(136)]
    [Frame: 12, payload: 0-176 (177 bytes)]
    [Frame: 14, payload: 177-312 (136 bytes)]
    [Segment count: 2]
    [Reassembled TCP length: 313]
    [Reassembled TCP Data: 504f5354202f7072696e746572732f6a737072696e746572...]
Hypertext Transfer Protocol
    POST /printers/jsprinter HTTP/1.1\r\n
        [Expert Info (Chat/Sequence): POST /printers/jsprinter HTTP/1.1\r\n]
            [POST /printers/jsprinter HTTP/1.1\r\n]
            [Severity level: Chat]
            [Group: Sequence]
        Request Method: POST
        Request URI: /printers/jsprinter
        Request Version: HTTP/1.1
    Connection: Keep-Alive\r\n
    Content-Type: application/ipp\r\n
    User-Agent: Internet Print Provider\r\n
    Content-Length: 136\r\n
        [Content length: 136]
    Host: 192.168.0.111:40023\r\n
    \r\n
    [Full request URI: http://192.168.0.111:40023/printers/jsprinter]
    [HTTP request 1/1]
    [Response in frame: 16]
Internet Printing Protocol
    Version: 1.0
    Status-code: Successful (0x804x)
    Request ID: 11
    Operation attributes
        attributes-charset: utf-8
            Tag: Character set
            Name length: 18
            Name: attributes-charset
            Value length: 5
            Value: utf-8
        attributes-natural-language: en-us
            Tag: Natural language
            Name length: 27
            Name: attributes-natural-language
            Value length: 5
            Value: en-us
        printer-uri: http://192.168.0.111:40023/printers/jsprinter
            Tag: URI
            Name length: 11
            Name: printer-uri
            Value length: 45
            Value: http://192.168.0.111:40023/printers/jsprinter
    End of attributes

No.     Time           Source                Destination           Protocol Length Info
     15 0.018373570    192.168.0.111         192.168.0.106         TCP      54     40023 → 59252 [ACK] Seq=1 Ack=314 Win=31360 Len=0

Frame 15: 54 bytes on wire (432 bits), 54 bytes captured (432 bits) on interface 0
    Interface id: 0 (wlp1s0)
    Encapsulation type: Ethernet (1)
    Arrival Time: Nov 26, 2015 00:37:35.287178191 EST
    [Time shift for this packet: 0.000000000 seconds]
    Epoch Time: 1448516255.287178191 seconds
    [Time delta from previous captured frame: 0.000025234 seconds]
    [Time delta from previous displayed frame: 0.000025234 seconds]
    [Time since reference or first frame: 0.018373570 seconds]
    Frame Number: 15
    Frame Length: 54 bytes (432 bits)
    Capture Length: 54 bytes (432 bits)
    [Frame is marked: False]
    [Frame is ignored: False]
    [Protocols in frame: eth:ethertype:ip:tcp]
    [Coloring Rule Name: TCP]
    [Coloring Rule String: tcp]
Ethernet II, Src: HonHaiPr_f1:8a:fd (2c:33:7a:f1:8a:fd), Dst: HonHaiPr_f1:8c:bb (2c:33:7a:f1:8c:bb)
    Destination: HonHaiPr_f1:8c:bb (2c:33:7a:f1:8c:bb)
        Address: HonHaiPr_f1:8c:bb (2c:33:7a:f1:8c:bb)
        .... ..0. .... .... .... .... = LG bit: Globally unique address (factory default)
        .... ...0 .... .... .... .... = IG bit: Individual address (unicast)
    Source: HonHaiPr_f1:8a:fd (2c:33:7a:f1:8a:fd)
        Address: HonHaiPr_f1:8a:fd (2c:33:7a:f1:8a:fd)
        .... ..0. .... .... .... .... = LG bit: Globally unique address (factory default)
        .... ...0 .... .... .... .... = IG bit: Individual address (unicast)
    Type: IPv4 (0x0800)
Internet Protocol Version 4, Src: 192.168.0.111, Dst: 192.168.0.106
    0100 .... = Version: 4
    .... 0101 = Header Length: 20 bytes
    Differentiated Services Field: 0x00 (DSCP: CS0, ECN: Not-ECT)
        0000 00.. = Differentiated Services Codepoint: Default (0)
        .... ..00 = Explicit Congestion Notification: Not ECN-Capable Transport (0)
    Total Length: 40
    Identification: 0x6d7a (28026)
    Flags: 0x02 (Don't Fragment)
        0... .... = Reserved bit: Not set
        .1.. .... = Don't fragment: Set
        ..0. .... = More fragments: Not set
    Fragment offset: 0
    Time to live: 64
    Protocol: TCP (6)
    Header checksum: 0x4b2c [validation disabled]
        [Good: False]
        [Bad: False]
    Source: 192.168.0.111
    Destination: 192.168.0.106
Transmission Control Protocol, Src Port: 40023 (40023), Dst Port: 59252 (59252), Seq: 1, Ack: 314, Len: 0
    Source Port: 40023
    Destination Port: 59252
    [Stream index: 1]
    [TCP Segment Len: 0]
    Sequence number: 1    (relative sequence number)
    Acknowledgment number: 314    (relative ack number)
    Header Length: 20 bytes
    Flags: 0x010 (ACK)
        000. .... .... = Reserved: Not set
        ...0 .... .... = Nonce: Not set
        .... 0... .... = Congestion Window Reduced (CWR): Not set
        .... .0.. .... = ECN-Echo: Not set
        .... ..0. .... = Urgent: Not set
        .... ...1 .... = Acknowledgment: Set
        .... .... 0... = Push: Not set
        .... .... .0.. = Reset: Not set
        .... .... ..0. = Syn: Not set
        .... .... ...0 = Fin: Not set
        [TCP Flags: *******A****]
    Window size value: 245
    [Calculated window size: 31360]
    [Window size scaling factor: 128]
    Checksum: 0xeb5b [validation disabled]
        [Good Checksum: False]
        [Bad Checksum: False]
    Urgent pointer: 0
    [SEQ/ACK analysis]
        [This is an ACK to the segment in frame: 14]
        [The RTT to ACK the segment was: 0.000025234 seconds]
        [iRTT: 0.002306594 seconds]

No.     Time           Source                Destination           Protocol Length Info
     16 0.024100463    192.168.0.111         192.168.0.106         IPP      304    IPP response

Frame 16: 304 bytes on wire (2432 bits), 304 bytes captured (2432 bits) on interface 0
    Interface id: 0 (wlp1s0)
    Encapsulation type: Ethernet (1)
    Arrival Time: Nov 26, 2015 00:37:35.292905084 EST
    [Time shift for this packet: 0.000000000 seconds]
    Epoch Time: 1448516255.292905084 seconds
    [Time delta from previous captured frame: 0.005726893 seconds]
    [Time delta from previous displayed frame: 0.005726893 seconds]
    [Time since reference or first frame: 0.024100463 seconds]
    Frame Number: 16
    Frame Length: 304 bytes (2432 bits)
    Capture Length: 304 bytes (2432 bits)
    [Frame is marked: False]
    [Frame is ignored: False]
    [Protocols in frame: eth:ethertype:ip:tcp:http:ipp]
    [Coloring Rule Name: HTTP]
    [Coloring Rule String: http || tcp.port == 80 || http2]
Ethernet II, Src: HonHaiPr_f1:8a:fd (2c:33:7a:f1:8a:fd), Dst: HonHaiPr_f1:8c:bb (2c:33:7a:f1:8c:bb)
    Destination: HonHaiPr_f1:8c:bb (2c:33:7a:f1:8c:bb)
        Address: HonHaiPr_f1:8c:bb (2c:33:7a:f1:8c:bb)
        .... ..0. .... .... .... .... = LG bit: Globally unique address (factory default)
        .... ...0 .... .... .... .... = IG bit: Individual address (unicast)
    Source: HonHaiPr_f1:8a:fd (2c:33:7a:f1:8a:fd)
        Address: HonHaiPr_f1:8a:fd (2c:33:7a:f1:8a:fd)
        .... ..0. .... .... .... .... = LG bit: Globally unique address (factory default)
        .... ...0 .... .... .... .... = IG bit: Individual address (unicast)
    Type: IPv4 (0x0800)
Internet Protocol Version 4, Src: 192.168.0.111, Dst: 192.168.0.106
    0100 .... = Version: 4
    .... 0101 = Header Length: 20 bytes
    Differentiated Services Field: 0x00 (DSCP: CS0, ECN: Not-ECT)
        0000 00.. = Differentiated Services Codepoint: Default (0)
        .... ..00 = Explicit Congestion Notification: Not ECN-Capable Transport (0)
    Total Length: 290
    Identification: 0x6d7b (28027)
    Flags: 0x02 (Don't Fragment)
        0... .... = Reserved bit: Not set
        .1.. .... = Don't fragment: Set
        ..0. .... = More fragments: Not set
    Fragment offset: 0
    Time to live: 64
    Protocol: TCP (6)
    Header checksum: 0x4a31 [validation disabled]
        [Good: False]
        [Bad: False]
    Source: 192.168.0.111
    Destination: 192.168.0.106
Transmission Control Protocol, Src Port: 40023 (40023), Dst Port: 59252 (59252), Seq: 1, Ack: 314, Len: 250
    Source Port: 40023
    Destination Port: 59252
    [Stream index: 1]
    [TCP Segment Len: 250]
    Sequence number: 1    (relative sequence number)
    [Next sequence number: 251    (relative sequence number)]
    Acknowledgment number: 314    (relative ack number)
    Header Length: 20 bytes
    Flags: 0x018 (PSH, ACK)
        000. .... .... = Reserved: Not set
        ...0 .... .... = Nonce: Not set
        .... 0... .... = Congestion Window Reduced (CWR): Not set
        .... .0.. .... = ECN-Echo: Not set
        .... ..0. .... = Urgent: Not set
        .... ...1 .... = Acknowledgment: Set
        .... .... 1... = Push: Set
        .... .... .0.. = Reset: Not set
        .... .... ..0. = Syn: Not set
        .... .... ...0 = Fin: Not set
        [TCP Flags: *******AP***]
    Window size value: 245
    [Calculated window size: 31360]
    [Window size scaling factor: 128]
    Checksum: 0x2652 [validation disabled]
        [Good Checksum: False]
        [Bad Checksum: False]
    Urgent pointer: 0
    [SEQ/ACK analysis]
        [iRTT: 0.002306594 seconds]
        [Bytes in flight: 250]
Hypertext Transfer Protocol
    HTTP/1.1 200 OK\r\n
        [Expert Info (Chat/Sequence): HTTP/1.1 200 OK\r\n]
            [HTTP/1.1 200 OK\r\n]
            [Severity level: Chat]
            [Group: Sequence]
        Request Version: HTTP/1.1
        Status Code: 200
        Response Phrase: OK
    Content-Length: 118\r\n
        [Content length: 118]
    Content-Type: application/ipp\r\n
    Date: Thu, 26 Nov 2015 05:37:35 GMT\r\n
    Connection: keep-alive\r\n
    \r\n
    [HTTP response 1/1]
    [Time since request: 0.005752127 seconds]
    [Request in frame: 14]
Internet Printing Protocol
    Version: 1.1
    Status-code: Successful (Successful-OK)
    Request ID: 11
    Operation attributes
        attributes-charset: utf-8
            Tag: Character set
            Name length: 18
            Name: attributes-charset
            Value length: 5
            Value: utf-8
        attributes-natural-language: en-us
            Tag: Natural language
            Name length: 27
            Name: attributes-natural-language
            Value length: 5
            Value: en-us
        status-message: 0005656e2d7573000d7375636365737366756c2d6f6b
            Tag: Text with language
            Name length: 14
            Name: status-message
            Value length: 22
            Value: 0005656e2d7573000d7375636365737366756c2d6f6b
    Unsupported attributes
    Printer attributes
    End of attributes

No.     Time           Source                Destination           Protocol Length Info
     17 0.065817483    192.168.0.106         192.168.0.111         TCP      54     59251 → 40023 [ACK] Seq=314 Ack=251 Win=65280 Len=0

Frame 17: 54 bytes on wire (432 bits), 54 bytes captured (432 bits) on interface 0
    Interface id: 0 (wlp1s0)
    Encapsulation type: Ethernet (1)
    Arrival Time: Nov 26, 2015 00:37:35.334622104 EST
    [Time shift for this packet: 0.000000000 seconds]
    Epoch Time: 1448516255.334622104 seconds
    [Time delta from previous captured frame: 0.041717020 seconds]
    [Time delta from previous displayed frame: 0.041717020 seconds]
    [Time since reference or first frame: 0.065817483 seconds]
    Frame Number: 17
    Frame Length: 54 bytes (432 bits)
    Capture Length: 54 bytes (432 bits)
    [Frame is marked: False]
    [Frame is ignored: False]
    [Protocols in frame: eth:ethertype:ip:tcp]
    [Coloring Rule Name: TCP]
    [Coloring Rule String: tcp]
Ethernet II, Src: HonHaiPr_f1:8c:bb (2c:33:7a:f1:8c:bb), Dst: HonHaiPr_f1:8a:fd (2c:33:7a:f1:8a:fd)
    Destination: HonHaiPr_f1:8a:fd (2c:33:7a:f1:8a:fd)
        Address: HonHaiPr_f1:8a:fd (2c:33:7a:f1:8a:fd)
        .... ..0. .... .... .... .... = LG bit: Globally unique address (factory default)
        .... ...0 .... .... .... .... = IG bit: Individual address (unicast)
    Source: HonHaiPr_f1:8c:bb (2c:33:7a:f1:8c:bb)
        Address: HonHaiPr_f1:8c:bb (2c:33:7a:f1:8c:bb)
        .... ..0. .... .... .... .... = LG bit: Globally unique address (factory default)
        .... ...0 .... .... .... .... = IG bit: Individual address (unicast)
    Type: IPv4 (0x0800)
Internet Protocol Version 4, Src: 192.168.0.106, Dst: 192.168.0.111
    0100 .... = Version: 4
    .... 0101 = Header Length: 20 bytes
    Differentiated Services Field: 0x00 (DSCP: CS0, ECN: Not-ECT)
        0000 00.. = Differentiated Services Codepoint: Default (0)
        .... ..00 = Explicit Congestion Notification: Not ECN-Capable Transport (0)
    Total Length: 40
    Identification: 0x6bf8 (27640)
    Flags: 0x02 (Don't Fragment)
        0... .... = Reserved bit: Not set
        .1.. .... = Don't fragment: Set
        ..0. .... = More fragments: Not set
    Fragment offset: 0
    Time to live: 128
    Protocol: TCP (6)
    Header checksum: 0x0cae [validation disabled]
        [Good: False]
        [Bad: False]
    Source: 192.168.0.106
    Destination: 192.168.0.111
Transmission Control Protocol, Src Port: 59251 (59251), Dst Port: 40023 (40023), Seq: 314, Ack: 251, Len: 0
    Source Port: 59251
    Destination Port: 40023
    [Stream index: 0]
    [TCP Segment Len: 0]
    Sequence number: 314    (relative sequence number)
    Acknowledgment number: 251    (relative ack number)
    Header Length: 20 bytes
    Flags: 0x010 (ACK)
        000. .... .... = Reserved: Not set
        ...0 .... .... = Nonce: Not set
        .... 0... .... = Congestion Window Reduced (CWR): Not set
        .... .0.. .... = ECN-Echo: Not set
        .... ..0. .... = Urgent: Not set
        .... ...1 .... = Acknowledgment: Set
        .... .... 0... = Push: Not set
        .... .... .0.. = Reset: Not set
        .... .... ..0. = Syn: Not set
        .... .... ...0 = Fin: Not set
        [TCP Flags: *******A****]
    Window size value: 255
    [Calculated window size: 65280]
    [Window size scaling factor: 256]
    Checksum: 0x1b03 [validation disabled]
        [Good Checksum: False]
        [Bad Checksum: False]
    Urgent pointer: 0
    [SEQ/ACK analysis]
        [This is an ACK to the segment in frame: 8]
        [The RTT to ACK the segment was: 0.058287138 seconds]
        [iRTT: 0.002515157 seconds]

No.     Time           Source                Destination           Protocol Length Info
     18 0.076690333    192.168.0.106         192.168.0.111         TCP      54     59252 → 40023 [ACK] Seq=314 Ack=251 Win=65280 Len=0

Frame 18: 54 bytes on wire (432 bits), 54 bytes captured (432 bits) on interface 0
    Interface id: 0 (wlp1s0)
    Encapsulation type: Ethernet (1)
    Arrival Time: Nov 26, 2015 00:37:35.345494954 EST
    [Time shift for this packet: 0.000000000 seconds]
    Epoch Time: 1448516255.345494954 seconds
    [Time delta from previous captured frame: 0.010872850 seconds]
    [Time delta from previous displayed frame: 0.010872850 seconds]
    [Time since reference or first frame: 0.076690333 seconds]
    Frame Number: 18
    Frame Length: 54 bytes (432 bits)
    Capture Length: 54 bytes (432 bits)
    [Frame is marked: False]
    [Frame is ignored: False]
    [Protocols in frame: eth:ethertype:ip:tcp]
    [Coloring Rule Name: TCP]
    [Coloring Rule String: tcp]
Ethernet II, Src: HonHaiPr_f1:8c:bb (2c:33:7a:f1:8c:bb), Dst: HonHaiPr_f1:8a:fd (2c:33:7a:f1:8a:fd)
    Destination: HonHaiPr_f1:8a:fd (2c:33:7a:f1:8a:fd)
        Address: HonHaiPr_f1:8a:fd (2c:33:7a:f1:8a:fd)
        .... ..0. .... .... .... .... = LG bit: Globally unique address (factory default)
        .... ...0 .... .... .... .... = IG bit: Individual address (unicast)
    Source: HonHaiPr_f1:8c:bb (2c:33:7a:f1:8c:bb)
        Address: HonHaiPr_f1:8c:bb (2c:33:7a:f1:8c:bb)
        .... ..0. .... .... .... .... = LG bit: Globally unique address (factory default)
        .... ...0 .... .... .... .... = IG bit: Individual address (unicast)
    Type: IPv4 (0x0800)
Internet Protocol Version 4, Src: 192.168.0.106, Dst: 192.168.0.111
    0100 .... = Version: 4
    .... 0101 = Header Length: 20 bytes
    Differentiated Services Field: 0x00 (DSCP: CS0, ECN: Not-ECT)
        0000 00.. = Differentiated Services Codepoint: Default (0)
        .... ..00 = Explicit Congestion Notification: Not ECN-Capable Transport (0)
    Total Length: 40
    Identification: 0x6bf9 (27641)
    Flags: 0x02 (Don't Fragment)
        0... .... = Reserved bit: Not set
        .1.. .... = Don't fragment: Set
        ..0. .... = More fragments: Not set
    Fragment offset: 0
    Time to live: 128
    Protocol: TCP (6)
    Header checksum: 0x0cad [validation disabled]
        [Good: False]
        [Bad: False]
    Source: 192.168.0.106
    Destination: 192.168.0.111
Transmission Control Protocol, Src Port: 59252 (59252), Dst Port: 40023 (40023), Seq: 314, Ack: 251, Len: 0
    Source Port: 59252
    Destination Port: 40023
    [Stream index: 1]
    [TCP Segment Len: 0]
    Sequence number: 314    (relative sequence number)
    Acknowledgment number: 251    (relative ack number)
    Header Length: 20 bytes
    Flags: 0x010 (ACK)
        000. .... .... = Reserved: Not set
        ...0 .... .... = Nonce: Not set
        .... 0... .... = Congestion Window Reduced (CWR): Not set
        .... .0.. .... = ECN-Echo: Not set
        .... ..0. .... = Urgent: Not set
        .... ...1 .... = Acknowledgment: Set
        .... .... 0... = Push: Not set
        .... .... .0.. = Reset: Not set
        .... .... ..0. = Syn: Not set
        .... .... ...0 = Fin: Not set
        [TCP Flags: *******A****]
    Window size value: 255
    [Calculated window size: 65280]
    [Window size scaling factor: 256]
    Checksum: 0xea57 [validation disabled]
        [Good Checksum: False]
        [Bad Checksum: False]
    Urgent pointer: 0
    [SEQ/ACK analysis]
        [This is an ACK to the segment in frame: 16]
        [The RTT to ACK the segment was: 0.052589870 seconds]
        [iRTT: 0.002306594 seconds]
```

**Comment by automaticgiant** [comment]
To be clear, it is a Windows as a Client problem, not a Windows as a server problem. I've reproduced on linux.

**Comment by watson** [comment]
@automaticgiant thanks for the report. I've only tested this with an OS X 10.10.5 client, so there are unfortunately bound to be issues with other clients if they send requests to the server that are different from what I've experienced with OS X.

I'll look into this.

**Comment by watson** [comment]
@automaticgiant I've just released v0.3.1 that fixes a few of the issues you experiences (though maybe not all) - can I get you to try it out?

The debug info you attached above helped, but it for some reason didn't contain the operation id of each request. If you run the ipp-printer with the environment variable `DEBUG=*` then it will output some similar debugging information that will help me a lot in determining what's wrong.

**Comment by automaticgiant** [comment]
Just tried:
```
[automaticgiant@thinkgiant node-jsprinter]$ DEBUG=* ./index.js 
 ipp-printer IPP printer "jsprinter" listening on port 40023 +17ms
  ipp-printer HTTP request: POST /printers/jsprinter +2s
  ipp-printer IPP/1.0 operation 11 (request #11) +14ms [ { tag: 1,
    attributes: 
     [ { tag: 71, name: 'attributes-charset', values: [ 'utf-8' ] },
       { tag: 72,
         name: 'attributes-natural-language',
         values: [ 'en-us' ] },
       { tag: 69,
         name: 'printer-uri',
         values: [ 'http://192.168.0.101:40023/printers/jsprinter' ] } ] } ]
buffer.js:554
  if (string.length > 0 && (length < 0 || offset < 0))
            ^

TypeError: Cannot read property 'length' of undefined
    at Buffer.write (buffer.js:554:13)
    at Object.str.encode (/home/automaticgiant/Dropbox/git/node-jsprinter/node_modules/ipp-encoder/index.js:295:17)
    at Object.langstr.encode (/home/automaticgiant/Dropbox/git/node-jsprinter/node_modules/ipp-encoder/index.js:272:7)
    at /home/automaticgiant/Dropbox/git/node-jsprinter/node_modules/ipp-encoder/index.js:145:23
    at Array.forEach (native)
    at /home/automaticgiant/Dropbox/git/node-jsprinter/node_modules/ipp-encoder/index.js:124:16
    at Array.forEach (native)
    at /home/automaticgiant/Dropbox/git/node-jsprinter/node_modules/ipp-encoder/index.js:122:24
    at Array.forEach (native)
    at Object.encode (/home/automaticgiant/Dropbox/git/node-jsprinter/node_modules/ipp-encoder/index.js:119:16)
```
I nixed some output from express, and left you your debug output. Thanks for working through this. Your library provides (excepting the current windows problem) a fantastic alternative to an expensive cups install for some niche uses.

**Comment by watson** [comment]
It seems you have given it an an invalid response object. I agree the error message is not that useful, but it is trying to encode an attribute whos value is expected to be an object with a `lang` property but I think it's just a regular string.

I've released a new version of ipp-printer (v0.3.2) which - when in DEBUG mode - will output the response object just before it tries to encode it so that you can see what it is trying to encode even if it throws because of bad input.

In your particular case I would imagine part of your response have an attribute looking similar to this:

```js
{ tag: C.NAME_WITH_LANG, name: 'job-name', value: 'Foobar' }
```

It could also be `C.TEXT_WITH_LANG`, but the point is that it ends with `_WITH_LANG`, so it expects that the value is an object with a `lang` and a `value` property:

```js
{ tag: C.NAME_WITH_LANG, name: 'job-name', value: { lang: 'en-us', value: 'Foobar' } }
```

If you change it to that, then it should fix it.

Let me know if it it works

**Comment by automaticgiant** [comment]
```
       { tag: 72,
         name: 'attributes-natural-language',
         values: [ 'en-us' ] },
       { tag: 69,
         name: 'printer-uri',
         values: [ 'http://192.168.0.101:40023/printers/jsprinter' ] } ] } ]
  ipp-printer responding to request #11 +19ms { statusCode: 0,
  requestId: 11,
  groups: 
   [ { tag: 1,
       attributes: 
        [ { tag: 71, name: 'attributes-charset', value: 'utf-8' },
          { tag: 72, name: 'attributes-natural-language', value: 'en-us' },
          { tag: 53,
            name: 'status-message',
            value: { lang: 'en-us', value: 'successful-ok' } } ] },
     { tag: 4,
       attributes: 
        [ { tag: 69,
            name: 'printer-uri-supported',
            value: 'ipp://thinkgiant.:undefined/' },
          { tag: 68, name: 'uri-security-supported', value: 'none' },
          { tag: 68, name: 'uri-authentication-supported', value: 'none' },
          { tag: 54, name: 'printer-name', value: 'jsprinter' },
          { tag: 35, name: 'printer-state', value: 3 },
          { tag: 68, name: 'printer-state-reasons', value: 'none' },
          { tag: 68, name: 'ipp-versions-supported', value: '1.1' },
          { tag: 35,
            name: 'operations-supported',
            values: [ 2, 4, 10, 11, 8, 9 ] },
          { tag: 71, name: 'charset-configured', value: 'utf-8' },
          { tag: 71, name: 'charset-supported', value: 'utf-8' },
          { tag: 72, name: 'natural-language-configured', value: 'en-us' },
          { tag: 72,
            name: 'generated-natural-language-supported',
            value: 'en-us' },
          { tag: 73,
            name: 'document-format-default',
            value: 'application/postscript' },
          { tag: 73,
            name: 'document-format-supported',
            values: 
             [ 'text/html',
               'text/plain',
               'application/vnd.hp-PCL',
               'application/octet-stream',
               'application/pdf',
               'application/postscript' ] },
          { tag: 34, name: 'printer-is-accepting-jobs', value: true },
          { tag: 33, name: 'queued-job-count', value: 0 },
          { tag: 68,
            name: 'pdl-override-supported',
            value: 'not-attempted' },
          { tag: 33, name: 'printer-up-time', value: 22 },
          { tag: 68, name: 'compression-supported', value: 'none' } ] } ] }
buffer.js:554
  if (string.length > 0 && (length < 0 || offset < 0))
            ^

TypeError: Cannot read property 'length' of undefined
    at Buffer.write (buffer.js:554:13)
    at Object.str.encode (/home/automaticgiant/Dropbox/git/node-jsprinter/node_modules/ipp-encoder/index.js:295:17)
    at Object.langstr.encode (/home/automaticgiant/Dropbox/git/node-jsprinter/node_modules/ipp-encoder/index.js:272:7)
    at /home/automaticgiant/Dropbox/git/node-jsprinter/node_modules/ipp-encoder/index.js:145:23
    at Array.forEach (native)
    at /home/automaticgiant/Dropbox/git/node-jsprinter/node_modules/ipp-encoder/index.js:124:16
    at Array.forEach (native)
    at /home/automaticgiant/Dropbox/git/node-jsprinter/node_modules/ipp-encoder/index.js:122:24
    at Array.forEach (native)
    at Object.encode (/home/automaticgiant/Dropbox/git/node-jsprinter/node_modules/ipp-encoder/index.js:119:16)
```

**Comment by watson** [comment]
Ups, thanks for the quick response. I also just realised that this most likely is a bug with an automatic response from the module. I found a place where I in fact didn't use the proper language object. It's fixed now in v0.3.3. 

Sorry for the mixup - please try again :)

**Comment by automaticgiant** [comment]
What do you mean I gave it an invalid response object? Doesn't it generate the response? (typo?)

**Comment by automaticgiant** [comment]
```
  ipp-printer IPP printer "jsprinter" listening on port 40023 +18ms
  ipp-printer HTTP request: POST /printers/jsprinter +2s
  ipp-printer IPP/1.0 operation 11 (request #11) +14ms [ { tag: 1,
    attributes: 
     [ { tag: 71, name: 'attributes-charset', values: [ 'utf-8' ] },
       { tag: 72,
         name: 'attributes-natural-language',
         values: [ 'en-us' ] },
       { tag: 69,
         name: 'printer-uri',
         values: [ 'http://192.168.0.101:40023/printers/jsprinter' ] } ] } ]
  ipp-printer responding to request #11 +16ms { statusCode: 0,
  requestId: 11,
  groups: 
   [ { tag: 1,
       attributes: 
        [ { tag: 71, name: 'attributes-charset', value: 'utf-8' },
          { tag: 72, name: 'attributes-natural-language', value: 'en-us' },
          { tag: 53,
            name: 'status-message',
            value: { lang: 'en-us', value: 'successful-ok' } } ] },
     { tag: 4,
       attributes: 
        [ { tag: 69,
            name: 'printer-uri-supported',
            value: 'ipp://thinkgiant.:undefined/' },
          { tag: 68, name: 'uri-security-supported', value: 'none' },
          { tag: 68, name: 'uri-authentication-supported', value: 'none' },
          { tag: 54,
            name: 'printer-name',
            value: { lang: 'en-us', value: 'jsprinter' } },
          { tag: 35, name: 'printer-state', value: 3 },
          { tag: 68, name: 'printer-state-reasons', value: 'none' },
          { tag: 68, name: 'ipp-versions-supported', value: '1.1' },
          { tag: 35,
            name: 'operations-supported',
            values: [ 2, 4, 10, 11, 8, 9 ] },
          { tag: 71, name: 'charset-configured', value: 'utf-8' },
          { tag: 71, name: 'charset-supported', value: 'utf-8' },
          { tag: 72, name: 'natural-language-configured', value: 'en-us' },
          { tag: 72,
            name: 'generated-natural-language-supported',
            value: 'en-us' },
          { tag: 73,
            name: 'document-format-default',
            value: 'application/postscript' },
          { tag: 73,
            name: 'document-format-supported',
            values: 
             [ 'text/html',
               'text/plain',
               'application/vnd.hp-PCL',
               'application/octet-stream',
               'application/pdf',
               'application/postscript' ] },
          { tag: 34, name: 'printer-is-accepting-jobs', value: true },
          { tag: 33, name: 'queued-job-count', value: 0 },
          { tag: 68,
            name: 'pdl-override-supported',
            value: 'not-attempted' },
          { tag: 33, name: 'printer-up-time', value: 2 },
          { tag: 68, name: 'compression-supported', value: 'none' } ] } ] }
/home/automaticgiant/Dropbox/git/node-jsprinter/node_modules/ipp-encoder/index.js:124
        values.forEach(function (val, i) {
              ^

TypeError: Cannot read property 'forEach' of undefined
    at /home/automaticgiant/Dropbox/git/node-jsprinter/node_modules/ipp-encoder/index.js:124:15
    at Array.forEach (native)
    at /home/automaticgiant/Dropbox/git/node-jsprinter/node_modules/ipp-encoder/index.js:122:24
    at Array.forEach (native)
    at Object.encode (/home/automaticgiant/Dropbox/git/node-jsprinter/node_modules/ipp-encoder/index.js:119:16)
    at send (/home/automaticgiant/Dropbox/git/node-jsprinter/node_modules/ipp-printer/index.js:165:26)
    at send (/home/automaticgiant/Dropbox/git/node-jsprinter/node_modules/ipp-printer/index.js:154:46)
    at Object.getPrinterAttributes (/home/automaticgiant/Dropbox/git/node-jsprinter/node_modules/ipp-printer/lib/operations.js:36:7)
    at router (/home/automaticgiant/Dropbox/git/node-jsprinter/node_modules/ipp-printer/index.js:132:54)
    at IncomingMessage.consumeAttrGroups (/home/automaticgiant/Dropbox/git/node-jsprinter/node_modules/ipp-printer/index.js:83:7)
```

**Comment by automaticgiant** [comment]
Can I set you up a test client or send you a vm image or link to one to help?

**Comment by watson** [comment]
Yeah it's probably easier if I debug this myself. I can set up a windows box my self in VirtualBox - what version of windows are you using as client?

**Comment by automaticgiant** [comment]
That page has downloads for xp, vista, 7, 8, 8.1, and 10, in case you want to expand your ipp client compatibility.

**Comment by automaticgiant** [comment]
r

**Comment by watson** [comment]
I've gotten a VM up an running now and I'm getting the same error as you. I'll report back when I've cracked it :smiley:

**Comment by automaticgiant** [comment]
:+1:

**Comment by watson** [comment]
I've gotten it to work on Windows now - it's released on npm in v0.4.0.

Here is how I set it up on Windows XP:

![s1](https://cloud.githubusercontent.com/assets/10602/11460481/2382c808-96bb-11e5-8c10-11802322eabb.png)
![s2](https://cloud.githubusercontent.com/assets/10602/11460486/23c59854-96bb-11e5-97b8-77f4bfa901a1.png)
![s3](https://cloud.githubusercontent.com/assets/10602/11460482/23ac3ad0-96bb-11e5-9706-113fb3c0e2ce.png)
![s4](https://cloud.githubusercontent.com/assets/10602/11460483/23c359c2-96bb-11e5-9d33-83c933b9c6de.png)
![s5](https://cloud.githubusercontent.com/assets/10602/11460485/23c51640-96bb-11e5-96f4-6031b324153c.png)
![s6](https://cloud.githubusercontent.com/assets/10602/11460484/23c483ba-96bb-11e5-89af-4a1fe696f3a1.png)

**Comment by automaticgiant** [comment]
Win 10 cannot connect, but at least it doesn't crash :/
```
  ipp-printer IPP printer "jsprinter" listening on port 40023 +14ms
  ipp-printer HTTP request: POST /printers/jsprinter +2s
  ipp-printer IPP/1.0 operation 11 (request #11) +13ms [ { tag: 1,
    attributes: 
     [ { tag: 71, name: 'attributes-charset', values: [ 'utf-8' ] },
       { tag: 72,
         name: 'attributes-natural-language',
         values: [ 'en-us' ] },
       { tag: 69,
         name: 'printer-uri',
         values: [ 'http://192.168.0.102:40023/printers/jsprinter' ] } ] } ]
  ipp-printer responding to request #11 +16ms { statusCode: 0,
  requestId: 11,
  groups: 
   [ { tag: 1,
       attributes: 
        [ { tag: 71, name: 'attributes-charset', value: 'utf-8' },
          { tag: 72, name: 'attributes-natural-language', value: 'en-us' },
          { tag: 53,
            name: 'status-message',
            value: { lang: 'en-us', value: 'successful-ok' } } ] },
     { tag: 4,
       attributes: 
        [ { tag: 69,
            name: 'printer-uri-supported',
            value: 'ipp://thinkgiant.:undefined/' },
          { tag: 68, name: 'uri-security-supported', value: 'none' },
          { tag: 68, name: 'uri-authentication-supported', value: 'none' },
          { tag: 54,
            name: 'printer-name',
            value: { lang: 'en-us', value: 'jsprinter' } },
          { tag: 35, name: 'printer-state', value: 3 },
          { tag: 68, name: 'printer-state-reasons', value: 'none' },
          { tag: 68, name: 'ipp-versions-supported', value: '1.1' },
          { tag: 35,
            name: 'operations-supported',
            values: [ 2, 4, 10, 11, 8, 9 ] },
          { tag: 71, name: 'charset-configured', value: 'utf-8' },
          { tag: 71, name: 'charset-supported', value: 'utf-8' },
          { tag: 72, name: 'natural-language-configured', value: 'en-us' },
          { tag: 72,
            name: 'generated-natural-language-supported',
            value: 'en-us' },
          { tag: 73,
            name: 'document-format-default',
            value: 'application/postscript' },
          { tag: 73,
            name: 'document-format-supported',
            values: 
             [ 'text/html',
               'text/plain',
               'application/vnd.hp-PCL',
               'application/octet-stream',
               'application/pdf',
               'application/postscript' ] },
          { tag: 34, name: 'printer-is-accepting-jobs', value: true },
          { tag: 33, name: 'queued-job-count', value: 0 },
          { tag: 68,
            name: 'pdl-override-supported',
            value: 'not-attempted' },
          { tag: 33, name: 'printer-up-time', value: 2 },
          { tag: 68, name: 'compression-supported', value: 'none' } ] } ] }
  ipp-printer HTTP request: POST /printers/jsprinter +24ms
  ipp-printer IPP/1.0 operation 11 (request #11) +3ms [ { tag: 1,
    attributes: 
     [ { tag: 71, name: 'attributes-charset', values: [ 'utf-8' ] },
       { tag: 72,
         name: 'attributes-natural-language',
         values: [ 'en-us' ] },
       { tag: 69,
         name: 'printer-uri',
         values: [ 'http://192.168.0.102:40023/printers/jsprinter' ] } ] } ]
  ipp-printer responding to request #11 +8ms { statusCode: 0,
  requestId: 11,
  groups: 
   [ { tag: 1,
       attributes: 
        [ { tag: 71, name: 'attributes-charset', value: 'utf-8' },
          { tag: 72, name: 'attributes-natural-language', value: 'en-us' },
          { tag: 53,
            name: 'status-message',
            value: { lang: 'en-us', value: 'successful-ok' } } ] },
     { tag: 4,
       attributes: 
        [ { tag: 69,
            name: 'printer-uri-supported',
            value: 'ipp://thinkgiant.:undefined/' },
          { tag: 68, name: 'uri-security-supported', value: 'none' },
          { tag: 68, name: 'uri-authentication-supported', value: 'none' },
          { tag: 54,
            name: 'printer-name',
            value: { lang: 'en-us', value: 'jsprinter' } },
          { tag: 35, name: 'printer-state', value: 3 },
          { tag: 68, name: 'printer-state-reasons', value: 'none' },
          { tag: 68, name: 'ipp-versions-supported', value: '1.1' },
          { tag: 35,
            name: 'operations-supported',
            values: [ 2, 4, 10, 11, 8, 9 ] },
          { tag: 71, name: 'charset-configured', value: 'utf-8' },
          { tag: 71, name: 'charset-supported', value: 'utf-8' },
          { tag: 72, name: 'natural-language-configured', value: 'en-us' },
          { tag: 72,
            name: 'generated-natural-language-supported',
            value: 'en-us' },
          { tag: 73,
            name: 'document-format-default',
            value: 'application/postscript' },
          { tag: 73,
            name: 'document-format-supported',
            values: 
             [ 'text/html',
               'text/plain',
               'application/vnd.hp-PCL',
               'application/octet-stream',
               'application/pdf',
               'application/postscript' ] },
          { tag: 34, name: 'printer-is-accepting-jobs', value: true },
          { tag: 33, name: 'queued-job-count', value: 0 },
          { tag: 68,
            name: 'pdl-override-supported',
            value: 'not-attempted' },
          { tag: 33, name: 'printer-up-time', value: 2 },
          { tag: 68, name: 'compression-supported', value: 'none' } ] } ] }
```

**Comment by watson** [comment]
@automaticgiant ha, hoped there wasn't too much of a difference. I'll give it a shot :)

**Comment by watson** [comment]
@automaticgiant It worked fine for me on Windows 10. How do you set up the printer? Not knowing anything about Windows 10 I just followed this guide and it worked: http://www.zedt.eu/tech/windows/installing-an-ipp-printer-in-windows-10/

**Comment by watson** [comment]
@automaticgiant I just realised that the version I was testing against on Windows 10 was a few commits ahead of v0.7.0, so there might have been something in there that fixed the Windows 10 issue without me knowing it. I've now released it as v0.8.0

**Comment by automaticgiant** [comment]
Standalone seems to work, but some change broke my html list. I'ma close it and work on mine later. Good work team.
